funny,posted,last_edited,item_id,helpful,recommend,review
49 people found this review funny,"Posted November 28, 2014.",,332800,668 of 876 people (76%) found this review helpful,True,*freddy enters the room* *puts freddy head on* I'm just freddy *freddy walks away*10/10
1 person found this review funny,"Posted November 9, 2014.",,316720,16 of 22 people (73%) found this review helpful,True,I cry every time. Tears flooded my whole house. ;-;
,"Posted November 21, 2014.",,331470,12 of 20 people (60%) found this review helpful,True,A very interesting Visual novel. It is made by Russia but its still good. It is worth reading and its even free :D
,"Posted September 26, 2014.",,319510,3 of 4 people (75%) found this review helpful,True,"Want to play a horror game perfect for children and still wet your pants? Want to work as some dude who works as a security guard who watches the cameras? If you say yes to at least one of these, then this game is for your :Dps: Be sure to have spare underpants before you play this, if you don't, go buy more or else you have to clean the floor up."
,"Posted March 3, 2014.","Last edited November 21, 2014.",271290,5 of 8 people (63%) found this review helpful,True,"Very nice :D -----------------------R.I.P Hawken, you were a great game to play."
1 person found this review funny,"Posted May 2, 2015.",,339800,1 of 1 people (100%) found this review helpful,True,"Earn munie (money) by dating girls, bang girls, catgirl (or neko), alien, goddess. 10/10  If only life was that easy "
,"Posted November 10, 2014.",,327410,5 of 9 people (56%) found this review helpful,True,"A Bird Story is a very touching story about a normal primary school kid taking care of some random bird which is injured. What makes this game unique is that there is no dialogue, and yet very interesting story. Really worth playing if you are a fan of To the Moon."
,"Posted November 24, 2014.",,334660,1 of 3 people (33%) found this review helpful,True,Get this for the meaning of kawaii
