funny,posted,last_edited,item_id,helpful,recommend,review
,"Posted March 18, 2013.",,208670,0 of 1 people (0%) found this review helpful,True,Brilliant and fantastic and then brilliant some more.If you can get over the heroine's accent.
,"Posted June 20, 2014.",,249680,No ratings yet,True,Do yourself a favour and buy this game immediately
,"Posted March 3, 2014.",,98400,No ratings yet,True,"It's a First Person Cyberpunk Shooter with robots, what's not to love?The story is a little predictable, but the game is solid and has excellent flow."
,"Posted February 9, 2014.",,108710,No ratings yet,True,"Third person, story-based, thrilling and completely enthralling. A fantatic work of art that clearly defined a tone and stuck to it for the duration. The core mechanics did not become tedious as I'd originally assumed. The game is paced expertly and culminates in a fantastic ending that kept me thinking."
,"Posted December 24, 2013.",,261030,No ratings yet,True,"Thrilling, Intense and gripping beyond belief. TWD:S2 creates an atmosphere I never would have believed capable of a video game. Get it now and eagerly await the release of future episodes!"
,"Posted December 4, 2013.",,38720,No ratings yet,True,A quirky and fun puzzler that's sure to entertain! Perfect for a rainy afternoon when you don't know what to play.
,"Posted October 28, 2013.",,50300,No ratings yet,True,"I absolutely adore this game.Not just a generic, brown shooter - SO much more.Just trust me on this one."
,"Posted July 16, 2013.",,207610,No ratings yet,True,"It's surprisingly well done in the style of the comic series with genuine emotion, fantasic writing and a main character I didn't hate, because it was me."
,"Posted June 7, 2013.",,220780,No ratings yet,True,Fictional characters more believable than real people and a story that drags on just the right amount.
