funny,posted,last_edited,item_id,helpful,recommend,review
25 people found this review funny,Posted April 8.,,394690,18 of 24 people (75%) found this review helpful,True,"This game is yummy, I'm gonna lick it."
7 people found this review funny,Posted March 10.,,438690,12 of 18 people (67%) found this review helpful,False,Not as advertisedNo 'Boom' sound when boosting = no satisfactionI will not be milking it's nipples as I wanted toDevs plos fix
2 people found this review funny,Posted February 5.,,319560,1 of 3 people (33%) found this review helpful,True,Spread blueness and flatness
,"Posted December 4, 2015.",,252950,0 of 1 people (0%) found this review helpful,True,Cars with Soccer.
,"Posted June 29, 2015.",,301910,No ratings yet,True,If you like Frozen ~ Buy it
