funny,posted,last_edited,item_id,helpful,recommend,review
8 people found this review funny,Posted May 26.,,405310,2 of 4 people (50%) found this review helpful,True,I would recommend 1337/420 just for speed glitch
,Posted June 17.,,730,0 of 1 people (0%) found this review helpful,False,IS ♥♥♥♥
,Posted May 26.,,440,No ratings yet,True,After watching the three videos on the Steam Store for Team Fortress 2 I am really excited to play this gameIt looks pretty good!!
,"Posted May 26, 2015.",,346900,No ratings yet,True,"Cookie Clicker on Steam, Just 100% swaggier"
,"Posted March 10, 2015.",,38720,No ratings yet,True,Rush is a very fun and tricky game. I found the challenges to be very entertaining seeing what type of stratergies I could come up with. 10/10
,"Posted January 15, 2015.",,281690,No ratings yet,True,"Game was really fun, especially the pro-bending. It would be awesome if there was a online version of pro-bending"
