funny,posted,last_edited,item_id,helpful,recommend,review
,"Posted April 26, 2014.",,243870,5 of 5 people (100%) found this review helpful,True,This Game Is free (:O). So The Game Is Third Person. I Also Like this Game :3.
,"Posted May 11, 2014.",,570,2 of 2 people (100%) found this review helpful,True,DotA 2 Is a F2P Game (Of Course). That The GAme is... idk
,"Posted April 12, 2014.",,208090,2 of 2 people (100%) found this review helpful,True,"Loadout is an outrageous new multi-player shooter that’s all about the guns, baby! Build a massive variety of absolutely insane weaponry - billions of combinations - totally customized, totally unique, and totally deadly."
,"Posted December 17, 2014.",,49520,1 of 1 people (100%) found this review helpful,True,This Game Is Perfectly Awesome. I really Love It. The boss Battle And All that. It Has Sooo Many Creatures To kill Awesome. But Can You Change The Graphic A Little Lower Or Higher :).
,"Posted April 12, 2014.",,550,1 of 1 people (100%) found this review helpful,True,"Set in the zombie apocalypse, Left 4 Dead 2 (L4D2) is the highly anticipated sequel to the award-winning Left 4 Dead, the #1 co-op game of 2008. This co-operative action horror FPS takes you and your friends through the cities, swamps and cemeteries of the Deep South, from Savannah to New Orleans across five expansive campaigns. Best Game Evah....(Not so)"
,"Posted April 12, 2014.",,440,1 of 1 people (100%) found this review helpful,True,Tf2 The F2P Game That Is Made From Valve xD. This Is My First Game.
,Posted July 15.,Last edited July 15.,730,No ratings yet,False,90% of the stupid asians are salty. No offense.
,Posted February 7.,,240,No ratings yet,True,just bought css yesterday-spam ak at ppl (or any gun) from long range +1 kill.-Good for low end PC's-Better Then csgo (in my opinion)-killed +100 ppl in deathmatch-Illuminati game-Ez awp-Everything Is Best11/10 Best Game
