funny,posted,last_edited,item_id,helpful,recommend,review
,"Posted August 17, 2014.",,730,1 of 1 people (100%) found this review helpful,True,สมัน ชอบ คับ
,"Posted December 13, 2013.",,4000,0 of 1 people (0%) found this review helpful,True,สนุกมาก สร้างสรรค์ ดี ชอบๆ รีบหาซื้อมา ซะ 555
,"Posted June 5, 2014.",,63380,No ratings yet,True,I like Bullet
,"Posted April 26, 2014.",,400,No ratings yet,True,It Funny use brain to find solution xDbut.... it Short Story I love Portal gun :D
,"Posted March 27, 2014.",,550,No ratings yet,True,Nice Game Survival form Zombie Have a Special ZombieI like this :3
