funny,posted,last_edited,item_id,helpful,recommend,review
3 people found this review funny,"Posted October 31, 2014.",,99810,75 of 124 people (60%) found this review helpful,False,Terrible experience with 'Games for Windows Live'.
,"Posted October 3, 2015.",,303210,1 of 1 people (100%) found this review helpful,True,...
,Posted August 2.,,211820,1 of 2 people (50%) found this review helpful,False,"Not as fun as it could be. The weapon switch delay is frustrating, even if it is 'fair'. Weapon feel is off, hitboxes seem wrong.The way tooltips open partially offscreen. The grappling hooks are enticing, but crippled. Some of the boss fights are stiff, frustrating, grindy. The difficulty curve is too steep in places. Tech progression is scarce."
,Posted July 8.,,353370,0 of 1 people (0%) found this review helpful,True,Definitely worth investing some learning & practice time.
1 person found this review funny,"Posted February 7, 2015.",,323320,0 of 1 people (0%) found this review helpful,True,"Good, stress-free fun. It's nice to play a game so kinetic, rather than 'who's got the biggest numbers'. Just needs an elastic grappling gun."
,Posted February 20.,,41100,No ratings yet,True,Great fun! Turn the mouse sensitivity way up.
,"Posted September 29, 2014.",,219890,No ratings yet,True,Love the non-euclidean geometry!
