funny,posted,last_edited,item_id,helpful,recommend,review
2 people found this review funny,"Posted December 11, 2012.",,218230,3 of 3 people (100%) found this review helpful,True,THIS GAME IS AWSM
,"Posted June 13, 2014.",,48700,1 of 1 people (100%) found this review helpful,True,"Awesome game, recommend 10/10"
1 person found this review funny,"Posted December 23, 2011.",,22350,2 of 3 people (67%) found this review helpful,True,"great game, fast paced great customization and cool accents!"
,Posted June 10.,,218620,1 of 3 people (33%) found this review helpful,True,"Everything that made me angry about the game, they fixed..."
,"Posted April 21, 2014.",,244850,No ratings yet,True,"Love this game, realistic but fun :D"
,"Posted November 19, 2013.",,105600,No ratings yet,True,Much much much much better then minecraft!
,"Posted July 29, 2011.",,400,No ratings yet,True,awesome! btw the cake is a lie
,"Posted May 6, 2011.",,34350,No ratings yet,True,I love rts Ilike the whole map idea building up troops then taking over land.
