funny,posted,last_edited,item_id,helpful,recommend,review
,"Posted June 29, 2014.",,223470,3 of 4 people (75%) found this review helpful,True,Postal 2 is just..friggin...AMAZING.Y U NO HAS DIS GAME YET
,"Posted March 19, 2014.",,4000,1 of 1 people (100%) found this review helpful,True,"This game is fun, wtf r u doing without it"
,"Posted April 18, 2014.",,228380,No ratings yet,True,Awesome graphics and high FPS
,"Posted April 4, 2014.",,220200,No ratings yet,True,It's fun if you know what your doing 8-9/10
,"Posted December 24, 2013.",,440,No ratings yet,True,shoot to kill XD'Cry Some More'                -Heavy
