funny,posted,last_edited,item_id,helpful,recommend,review
,"Posted August 14, 2014.",,204100,1 of 1 people (100%) found this review helpful,True,Bullet time is the ♥♥♥♥
1 person found this review funny,"Posted February 28, 2015.",,262060,3 of 6 people (50%) found this review helpful,True,yeah its fun 9/11 would dark again
,"Posted September 19, 2014.",,266510,1 of 3 people (33%) found this review helpful,True,simply amazing 
,"Posted December 15, 2014.",,248860,2 of 8 people (25%) found this review helpful,True,I was minding my own bussiness when i was rudely woken up by 6 melon heads.My trible war club had a lot of fun that night.8/8 m8
,"Posted October 24, 2014.",,226700,67 of 145 people (46%) found this review helpful,True,this gave my cancer ebola
