funny,posted,last_edited,item_id,helpful,recommend,review
,"Posted January 12, 2015.",,322330,No ratings yet,True,"1. Play with Friends2. Always check Your Ice Box (You know what I mean)3. Steal Friends' Stuffs4. Make Maxwell Mad5. Always check your chest (Again, Like 2nd Tip)6. Invite Friends to Trap Set Pieces7. Killing Bosses Together8. Download something That Your Friends Don't Have (Like weapons, Mobs, etc)9. Trap Your Friends to That Stuffs (Next Step of 8th Tip)10. The Cycle has begin over and over...over again"
,"Posted November 13, 2014.","Last edited November 14, 2014.",550,No ratings yet,True,"How about some nice bottle of molotov, zombies?I hope ya like it.  :)"
,"Posted November 12, 2014.",,219740,No ratings yet,True,Bees... Bees everywhere...
,"Posted December 20, 2013.",,47410,No ratings yet,True,"Hey there, dude. This game is a top of Free-to-play game...so this game is 5 of 5 (first is TF2). Don't forget to play this game 'Cuz this F2P man said for this.....anyway the Chrismas will appear here soon.                                                                                                                                                                   -The mad demoman"
,"Posted November 19, 2013.",,224260,No ratings yet,True,"Like a horror game,eh? Well,play this game for more horror! so.. this game wil give you, guns with some ammo and with no cilp,somthing you can use it like weapons.when you die...you will become one of 'them', so well, you can leave the comment  to the lastest F2P guy."
,"Posted August 21, 2013.","Last edited February 10, 2014.",440,No ratings yet,True,"This game has many kind of classes. Choose your favorite class, new TF2? don't sweat it!, game got a character for you. So what is your style?. Quick moves , heavy damage , healer , builder and MORE.If you are new TF2 training yourself will be must help you hone your skills 'fore jumping into one of TF2's many game modes., including , Capture the Flag , Area , King Of The Hill and more!"
,"Posted March 28, 2013.",,104700,No ratings yet,True,i dont want anything of this game but one thing when playing this game it is a HAT!!! (TF2)because my guy namded 'AriLou' not give me any refrind metals                                                TURE STORY
,"Posted March 21, 2013.",,213650,No ratings yet,True,Dwarfs!?!??! wtf this game make for.....oh im sorry :P  this game is fun and very fun and ba ba ba ba ba ba ba ba ba ba ba ab ba ba ba ba
,"Posted March 2, 2013.",,200210,No ratings yet,True,i think some plepole ask : this is a 8 bit game!. but i think is a good game! than u think is 'Suck!'
