funny,posted,last_edited,item_id,helpful,recommend,review
,"Posted October 17, 2014.",,218620,2 of 3 people (67%) found this review helpful,True,Shield pushed me into a door while i was downed and i couldnt move 10/10
,"Posted March 13, 2015.",,348090,0 of 1 people (0%) found this review helpful,True,minigun-rocketlauncher combo....never fails...NEVER!
,"Posted December 16, 2014.",,211820,0 of 5 people (0%) found this review helpful,True,found something cute and it riped out my jugular. 10/10 would ♥♥♥♥ of again
,"Posted January 15, 2015.",,227480,No ratings yet,True,shot a skeleton in the face with a railgun..7.3/10 would skeleton again.
,"Posted December 18, 2014.",,253710,No ratings yet,True,found a tree next to a rock sat there for some time. saw a dear and killed it  10/10 would sit again
