funny,posted,last_edited,item_id,helpful,recommend,review
7 people found this review funny,Posted January 13.,,405640,12 of 13 people (92%) found this review helpful,True,"Holy,Exotic,Leaping andPlausible are words i would say that relate to this game.It's..Magnificent.TomReally likes it.Also,Pony island'sPuzzling, theEnding...Dragged on a bit."
6 people found this review funny,Posted January 18.,,295110,16 of 23 people (70%) found this review helpful,False,"Plays 1.3 hours,Hasn't launched game, Launcher is bad, Help, Eh.....10-10/10"
1 person found this review funny,"Posted July 22, 2015.",,440,2 of 2 people (100%) found this review helpful,True,"I Possibly Might Of Played Too Much Of This Game. 1,608.4 Hours Out Of 1608.4."
2 people found this review funny,"Posted September 28, 2014.",Last edited January 27.,298600,2 of 2 people (100%) found this review helpful,True,Too Kawaii Desu Not To Buy Jyu/JyuNeeds To Be Renamed To Kawaii Planet.It's Pretty Hard Though.
,"Posted October 5, 2013.",Last edited January 27.,4000,2 of 2 people (100%) found this review helpful,True,It's a good game.
,"Posted January 30, 2015.","Last edited October 15, 2015.",339800,2 of 3 people (67%) found this review helpful,True,"A Good Game. Dunno Why Its Not Censored, But It Just Means I Don't Have To Install A Patch :312/12"
1 person found this review funny,"Posted October 1, 2014.",Last edited January 27.,319510,1 of 2 people (50%) found this review helpful,True,I can't have like a side thumb to say this game is meh so i'll just recommend it and say so.It's okay.Could be a bit more erm...It's okay.
,"Posted October 1, 2014.",,324170,2 of 5 people (40%) found this review helpful,True,Tis Good Tis Short 10/10
