funny,posted,last_edited,item_id,helpful,recommend,review
4 people found this review funny,"Posted June 12, 2013.",,218230,4 of 4 people (100%) found this review helpful,True,you can go in a space ship and go vroooooooooooooooom
1 person found this review funny,"Posted September 11, 2014.",,240,1 of 1 people (100%) found this review helpful,True,0/10 No sauce to be found ♥♥♥♥ing liars
6 people found this review funny,"Posted July 24, 2014.",,10500,2 of 4 people (50%) found this review helpful,True,It's time to kick those tea drinking pomie ♥♥♥♥♥ out of murica m8
1 person found this review funny,"Posted July 24, 2014.",,570,1 of 2 people (50%) found this review helpful,False,Leauge of leggins is bested
1 person found this review funny,"Posted September 11, 2014.",,730,No ratings yet,False,0/10 needs more hats
