funny,posted,last_edited,item_id,helpful,recommend,review
,"Posted February 15, 2014.",,20900,2 of 4 people (50%) found this review helpful,False,This game would be amazing if it ACTUALLY WORKED!!!!!!!!!!!
,"Posted November 28, 2014.",,236390,2 of 5 people (40%) found this review helpful,False,"Fun game but one massive problem.Whenever  I go into a game, i get above and beyond 1500 ping!!!Thats completely unacceptable."
,"Posted May 18, 2014.",,730,No ratings yet,False,"After the most recent update to this game, every twenty minutes or so, the game just stops for no reason and i have to restart my computer.Unacceptable.Fix and i'll be happy."
,"Posted February 15, 2014.",,209870,No ratings yet,False,"Looks very cool, but it would be nice if it actually worked."
,"Posted January 21, 2014.",,218230,No ratings yet,True,"Loved this game, thought it was great fun until one game-breaking, (well, a bit more than that) the game was deleted from my hard drive so i had to do the 9.1 gb download again.other than that, gg."
,"Posted December 10, 2013.",,113400,No ratings yet,False,"This game is a laggy, confusing, pathetic excuse for a game.Do not waste bandwidth or hard drive space on this game.It's not worth it"
