funny,posted,last_edited,item_id,helpful,recommend,review
,"Posted August 1, 2014.",,221100,9 of 14 people (64%) found this review helpful,True,Always play with your friends on Dayz. And have fun.
,"Posted October 30, 2014.",,4000,1 of 1 people (100%) found this review helpful,True,It's so ♥♥♥♥ing awesome it makes awesome look not awesome
,"Posted August 10, 2014.",,72850,1 of 1 people (100%) found this review helpful,True,it is ♥♥♥♥ing awesome
,Posted July 13.,,239140,No ratings yet,True,This a hella lot better than the dead island series. This Game is so realistic its like going outside. The graphics are off the charts and amazing.
,"Posted August 30, 2014.",,104900,No ratings yet,True,shooting dinos is sooo much fun
,"Posted July 7, 2014.",,252490,No ratings yet,True,"This game is amazing and if you are a Minecraft and Dayz fan, then you might want to try out Rust."
