funny,posted,last_edited,item_id,helpful,recommend,review
,"Posted November 14, 2014.",,265300,67 of 98 people (68%) found this review helpful,False,"I like this game quite a bit, but never have I experience so many crashes playing anything before in my life. It feels like there was no where near enough QA testing done before they released this, even several patches later I cant tell if anything has changed. The hardest thing to fight against in this game is the game LOTF.exe no jokeFIX THIS GAME AND MAKE IT PLAYABLE BEFORE YOU DECIDE TO RELEASE DLC!"
3 people found this review funny,"Posted November 14, 2014.",,246620,18 of 23 people (78%) found this review helpful,True,Many hours to be lost playing this. You too can live out your fantasy of being the evil scientist who tries to end the world!
,"Posted November 14, 2014.",,209650,32 of 51 people (63%) found this review helpful,False,No dedicated servers still. Can't recommend until they have them!
,"Posted November 14, 2014.",,237930,1 of 1 people (100%) found this review helpful,True,Would love another game like this!
,"Posted October 20, 2015.",,351970,11 of 81 people (14%) found this review helpful,False,Audio Fail... Distorted white noise blaring in my ears from the title screen and continues into the campaign. I think I’m entitled to have working sound with my game :(
,"Posted January 29, 2013.",,220440,No ratings yet,True,"Awesome addition to the DMC series!Better fluid combat mechanics compared to 'Devil May Cry 4' which helps when half a second can be the difference between a kickass combo or the game over screen. The story was meh... not bad but not good either, Game play is what makes this game good and as always in a DMC game the amount of difficulties you need to unlock gives some good replay value."
,"Posted January 2, 2013.",,4920,No ratings yet,True,awesome game
