funny,posted,last_edited,item_id,helpful,recommend,review
,Posted April 20.,Last edited April 20.,413150,1 of 1 people (100%) found this review helpful,True,A game has never made manual labour so fun!Side note: I've developed an insatiable hunger for quartz
1 person found this review funny,"Posted June 14, 2015.","Last edited June 16, 2015.",245170,1 of 1 people (100%) found this review helpful,True,"In a game full of sexualized nurses, school girls and cats, I play the giant saxophone black guy."
,Posted July 21.,,376300,No ratings yet,True,This is a soap opera masquerading as a fighting game.This is the best soap opera I've ever been bodied in.10/10 would attempt a halfcircle forward after a quatercircle back again.
,Posted January 20.,,391540,No ratings yet,True,I had a bad time. 10/10
,"Posted January 17, 2015.","Last edited January 17, 2015.",206420,No ratings yet,True,"Can't romance Keith David, 0/10.At least they give you Kinze..."
,"Posted October 11, 2013.","Last edited December 13, 2015.",218620,No ratings yet,True,"Despite the ♥♥♥♥♥torm that was Crimefest Day 1, the game has still retained the majority of its charm and playability. Despite the microtransactions, it is still an entertaining game."
