funny,posted,last_edited,item_id,helpful,recommend,review
,"Posted September 29, 2014.",,440,1 of 1 people (100%) found this review helpful,True,Do it for the love of hats
,"Posted June 18, 2014.",,242760,1 of 1 people (100%) found this review helpful,True,good for a good scare needs multiplayer and peaceful mode but it is still great to play
,"Posted August 6, 2014.",,241540,1 of 3 people (33%) found this review helpful,True,one of the best zombie games ive played nuf said
,"Posted December 17, 2015.",Last edited August 6.,391540,No ratings yet,True,Alright where shall I begin. This game is amazing well done and has had alot of thought and care when it comes to gameplay.at first the idea of three ending paths seems alittle of a turn off over then that this game is worth every dollar spent with the amazing charaters the intresting story and lore.without spoiling the game all that I can say isWHAT ARE YOU WAITING FOR BUY THE GAMEYou Idiot No really.... stop reading thisDont you have anything better to do....how about....Just buy the gameEdit6 August 2016 the game is ok but to be honest the fandom is pure cancer it was the reason i have lost intrest in this game
,"Posted December 17, 2014.",,218620,No ratings yet,True,well where to start hmmtop ten fav things about payday 210.random weapon mods 9.mask patterns 8.people in servers7.heist can vary sometimes6.when the heists go well5.having the heist go well but not as planned 4.BULLDOZER3.having a well planned plan2.MASKS1.UNICORN MASK (♥♥♥♥ YEAH)
,"Posted May 14, 2014.",,6060,No ratings yet,True,Why not
,"Posted January 24, 2014.",,4000,No ratings yet,True,well this is fun total fun from nukes to meteors this game has it all*mods not included *to be advised this game can be too much funand can cause lack of outside interactionthat is allLONG LIVE THE DJ EEVEE CREW
