funny,posted,last_edited,item_id,helpful,recommend,review
,"Posted September 5, 2014.",,41740,5 of 9 people (56%) found this review helpful,True,"This is such a great game, It is a wacky, fun, weird, game but i really love it."
3 people found this review funny,"Posted March 2, 2015.",,336100,1 of 3 people (33%) found this review helpful,True,"THIS GAME IS AMAZING, I nearly Have 20 hours, it is an awesome game. 10/10."
,"Posted March 1, 2015.",,268750,No ratings yet,True,"This is a great game, i love it, it is awesome. 10/10"
,"Posted November 10, 2014.",,250900,No ratings yet,True,"Great game.... i love it and musics great, graphics are awesome..."
,"Posted December 14, 2013.",,249050,No ratings yet,True,fun game it is only in alpha and i really like but could makeit a little less enermies when u grab the crystal and try to get to the exit.
,"Posted December 13, 2013.",,230050,No ratings yet,True,so fun go get this
