funny,posted,last_edited,item_id,helpful,recommend,review
1 person found this review funny,"Posted July 16, 2015.",,304930,2 of 2 people (100%) found this review helpful,True,"*Joins server* DAY 1. its cold, im naked, and there is someone running at me with a chainsawDAY 2. I respawned on some farm in the middle of nowhere, I see a chainsaw and I grab it and with quick success I mow down all the zombies around meDAY 3. I have created the best base ever known to man kindDAY 4. a group of griefers came and killed me and destroyed my base11/10 would be griefed again"
1 person found this review funny,"Posted June 28, 2015.",,550,1 of 1 people (100%) found this review helpful,True,"Lets just say, Your gonna need to bring a spare pair of clothes"
,"Posted June 19, 2015.",,730,1 of 1 people (100%) found this review helpful,True,Gun capable of  shooting in burstfire mode $300Set of plyers $40011/10 Would buy plyers again
1 person found this review funny,"Posted June 3, 2015.",,301520,1 of 2 people (50%) found this review helpful,True,"Saw a giant lego dude, flew into him with my flying dinosaur11/10 would destroy lego robots again"
4 people found this review funny,"Posted November 9, 2015.",,377160,5 of 11 people (45%) found this review helpful,True,"Cmon guys its fallout 4its visuals are amazing, its enemies are amazing everything about it so far is amazing!!If I had money i'd buy it for everyone"
,"Posted June 27, 2015.",,346110,No ratings yet,True,Warning! you need a very good computer!!looks like so much fun but I cannot play it with this computer even on lowest graphics
,"Posted May 16, 2015.",,440,No ratings yet,True,"I came for a good, entertaining, realistic fps... got killed by a fish    11/9 would get fish slapped again"
,"Posted February 4, 2015.",,11020,No ratings yet,True,One of the best free racing games i've played! sad that I dont know how do use the vehicles that I have painted though :l
