funny,posted,last_edited,item_id,helpful,recommend,review
,"Posted June 20, 2015.",,261570,0 of 1 people (0%) found this review helpful,True,"Beautiful, immersive, and a brilliant story. Ori and the Blind Forest is a must play."
,Posted January 19.,,391540,No ratings yet,True,"Yeee boi, so good."
,"Posted July 4, 2014.",,730,No ratings yet,True,Extremely addicting and keeps making me spend money. Definitely worth buying.
,"Posted July 17, 2012.",,33930,No ratings yet,True,DayZ.
,"Posted August 14, 2011.",,105600,No ratings yet,True,Its pretty good.
