funny,posted,last_edited,item_id,helpful,recommend,review
1 person found this review funny,"Posted December 26, 2013.",,221640,137 of 150 people (91%) found this review helpful,True,Punched my desk in rage and fractured my finger.10/10
,"Posted November 29, 2015.",,311210,1 of 2 people (50%) found this review helpful,True,A breath of fresh air in an ever repeating genre!
,"Posted October 10, 2014.",,292120,3 of 10 people (30%) found this review helpful,True,"No matter the complaints about the games performance, The game is still amazing."
,Posted August 27.,,227300,No ratings yet,True,Stupidly relaxing.
,"Posted October 23, 2015.",,402180,No ratings yet,True,"Gifted for the story, Stayed for dem anime tiddiez. 10/10 - IGN"
,"Posted May 8, 2014.",,204300,No ratings yet,True,"Only in this game, Can I live my dream of wearing no pants and killing octopi.TedMcPain/10"
