funny,posted,last_edited,item_id,helpful,recommend,review
,"Posted November 21, 2015.",,377160,1 of 3 people (33%) found this review helpful,True,"WTF I still have 0% chance of hitting grills damn this realism, thanks todd 10/10"
,"Posted September 18, 2015.",,214950,1 of 3 people (33%) found this review helpful,True,gay as aids
,Posted May 20.,,252490,0 of 1 people (0%) found this review helpful,True,Yeah made a slave camp and forced the 4 people to gather ♥♥♥♥ that spawned inside the walls they tryed to escape and I had to set an example so I killed one and fed it to the rest 10/10 would slave again.
,"Posted June 9, 2014.",,242760,0 of 2 people (0%) found this review helpful,True,"Omg, all the hype and waiting was worth it, hope to have co-op tho gets a bit lonly."
,"Posted December 3, 2014.",,47810,No ratings yet,True,"The RP was great, but it failed in combat gameplay 8/10"
,"Posted August 28, 2012.",,105600,No ratings yet,True,It is so fun ngjrdhyjh
