funny,posted,last_edited,item_id,helpful,recommend,review
,"Posted November 27, 2015.",,232090,24 of 38 people (63%) found this review helpful,False,Remember when one of the studio leads at TW said in a statement that Call of Duty ruined a generation of gamers and followed that by making a game years later and deciding to put microtransactions in an unfinished early access title?Pepperidge Farm Remembers.You'd think they would have learnt from OVERKILLS mistakes on that last bit there.
,"Posted December 11, 2015.",,218620,6 of 7 people (86%) found this review helpful,False,I swear to god this game is Bains side project to pay for his bad one liners and internet connection...I mean... It'd explain the f***ing 37 DLCs (not a joke).I'm done with this. I'm going back to PD1...
,"Posted May 31, 2014.",,242760,1 of 1 people (100%) found this review helpful,True,"For $15 and the amount of potential this game has, it's worth every cent/second you put into it!Crafting is alot more fun than most others and even the inventory screen is really well made to a survival aesthetic.If you need to see it just check out Frankieonpcin1080p and his video. He sums it up better than I can anyway :)"
,"Posted May 31, 2014.",,263440,1 of 3 people (33%) found this review helpful,True,"Hit a dinosaur in the rear with an arrow, proceeded to headbutt me to death.10/10"
,"Posted December 16, 2015.",,412332,0 of 1 people (0%) found this review helpful,True,I'm going to smack a positive on this just because it has incredible potential should the devs listen to the players. Only had a few issues but it was worth the $8.
