funny,posted,last_edited,item_id,helpful,recommend,review
,"Posted October 28, 2015.","Last edited October 28, 2015.",218680,No ratings yet,False,So easy unlike other scribblenauts games in the past. I recommend this game for 10 year olds and bellow if they have nothing to do whatsoever in the summer holidays.
,"Posted October 12, 2015.",,35460,No ratings yet,False,"All I can say about this game is... DON'T PLAY IT,DON'T EVEN LOOK AT IT,DO THIS AND YOU MIGHT LIVE!!!"
,"Posted October 12, 2015.",,3590,No ratings yet,True,Plants vs Zombies is a great game for newbies and expert players.I have lots of memories of playing this game with my friend taking turns through each level and building a good defence wall. If you play this game I recommend you play it with a friend you'll have a great time :)
,"Posted October 12, 2015.",,107410,No ratings yet,True,If you like war games and playing with your friends you should buy this.It's a good first person shooter much like arma 2 but a gazzillion times better :P
,"Posted October 4, 2014.",,203770,No ratings yet,True,"This game is really boring if you didn't read the tutorial, but really fun if you did.10/10 The money paid is worth it!!!"
,"Posted May 16, 2014.","Last edited October 12, 2015.",570,No ratings yet,True,"'people either hate this game or like this game, I for one don't like it.'That's what I said before I was addicted to this game :P"
,"Posted April 23, 2014.",,210770,No ratings yet,True,"This game is really worth playing, and its a great multiplayer 9.5/10"
