funny,posted,last_edited,item_id,helpful,recommend,review
4 people found this review funny,"Posted June 6, 2015.",,367120,2 of 5 people (40%) found this review helpful,True,the story is awesome :3 and also has a guy same name as me xD matthew try it if ur bored...and....SEDUCE ME!~TF2 spy
,Posted March 30.,,289650,0 of 1 people (0%) found this review helpful,False,fps ggwp
,"Posted April 26, 2015.",,355840,0 of 3 people (0%) found this review helpful,False,abit hard to aim and kinda laggy
3 people found this review funny,Posted June 5.,,411830,10 of 49 people (20%) found this review helpful,False,I had a good time playing the game while it lasted.I really tried my best to cope with the constant crashes every now n than however i couldnt take it.So i decided to reboot my computer hoping it would work but it made it worse.I cant even load the game and play it.Others are having this problem as wellJust pray when you buy this game you arent the ones who have this problem
,"Posted December 17, 2015.",,418340,No ratings yet,True,Needs more maps and charactersGameplay needs more work but has good potential10/10
