funny,posted,last_edited,item_id,helpful,recommend,review
,"Posted December 15, 2014.",,730,0 of 1 people (0%) found this review helpful,True,Beast <3
,"Posted August 27, 2015.",,400,No ratings yet,True,Self EXPLANTORY!
,"Posted August 27, 2015.",,4000,No ratings yet,True,This game is so funny with friends :D Do reccomend!
,"Posted July 3, 2015.",,221640,No ratings yet,True,I swear its not like your tripping LSD or anything...
,"Posted December 28, 2013.","Last edited December 28, 2013.",440,No ratings yet,True,Best F2P in my thoughts.
