funny,posted,last_edited,item_id,helpful,recommend,review
,Posted March 16.,,391540,No ratings yet,True,"just finished Undertale after weeks and weeks of playing, so worth it."
,"Posted April 2, 2015.",,252330,No ratings yet,True,I am making this review while Slender is paused in another tab and I am utterly terrified I have five pages in the second level and I and so surprised I made it this far because this s*** is HARD!
,"Posted December 12, 2014.",,332800,No ratings yet,True,the most intense RPG you can buy on the steam store or somthing like that.
,"Posted August 18, 2014.",,312990,No ratings yet,True,this game is free DLC for BRO FORCE and it lives up to it's EXTREME brother nicely
,"Posted February 13, 2014.","Last edited February 13, 2014.",4000,No ratings yet,True,Think of one reason to not like this game.
