funny,posted,last_edited,item_id,helpful,recommend,review
,"Posted June 26, 2015.",,330830,1 of 1 people (100%) found this review helpful,True,Instantly one of my favourite games of all times ITS DUCKING GOOD
,Posted March 26.,,570,No ratings yet,True,"Don't recommend if you enjoy being happy, otherwise 10/10!!!! :)"
,"Posted June 22, 2013.",,4000,No ratings yet,True,"Garry did a good job! Good on you Garry, hope wou keep making good mods! :|"
,"Posted August 25, 2012.",,201790,No ratings yet,True,i like it
,"Posted June 26, 2012.",,440,No ratings yet,True,'tis good
