funny,posted,last_edited,item_id,helpful,recommend,review
,"Posted August 21, 2015.","Last edited October 3, 2015.",205100,1 of 1 people (100%) found this review helpful,True,"The flow of this game is like no other, Story is compelling and gameplay is smooth, wide range of weapons, tools, and upgrades to play however you'd like to, plenty of replayability, The 3 DLC's are icing on the cake, letting you explore dunwall through a cometely different perspective 10/10"
,"Posted March 6, 2015.",,730,1 of 1 people (100%) found this review helpful,True,SO MANY FLASHBANGS.
,"Posted February 27, 2015.",,550,1 of 1 people (100%) found this review helpful,True,Great Graphics Great Weapons Great Mods11/9 would explode a jerry can again.
1 person found this review funny,"Posted March 7, 2015.",,239140,1 of 3 people (33%) found this review helpful,True,The creativity behind the weapons and Upgrades are unbelivable.
,"Posted March 20, 2015.",,7670,No ratings yet,True,Probably one of the best stories in a game i have ever played. plot twist/10
,"Posted November 27, 2014.",,218620,No ratings yet,True,"Stole Cash,Diamonds and Gold People saw. 8/10"
