funny,posted,last_edited,item_id,helpful,recommend,review
,"Posted March 25, 2015.",,570,1 of 1 people (100%) found this review helpful,True,"Amazing Game. First of all its addictive, second of all its fun. Did I meantion its addictive?"
,Posted January 7.,,224260,No ratings yet,True,"I like it alot, Fast paced defend yourself or go on the aggressive!You can also kill yourself with a gun by shooting yourself k."
,"Posted December 7, 2014.",,730,No ratings yet,True,♥♥♥♥♥
,"Posted July 25, 2014.",,224540,No ratings yet,True,
,"Posted June 20, 2014.",,440,No ratings yet,True,"Team fortress 2. a fast paced FPS with a range of stock wepons to help in battle, you can find more items randolmy or buy them at the mann co store! hats and misc item to coustomizse your class are also avalible the classes are:Scout. the fastest soldier, the rocket dude!pyro, FLAMES and more!"
