funny,posted,last_edited,item_id,helpful,recommend,review
,"Posted January 25, 2015.",,243870,2 of 2 people (100%) found this review helpful,True,Its just good :3
2 people found this review funny,Posted July 8.,,48720,1 of 8 people (13%) found this review helpful,False,Not very Good early game bandits have rifles and aibots that kill you in 2 shots that you get robbed and lose all your troops.GG well played you lost in the first 5 minutes.
,"Posted October 10, 2015.",,238960,No ratings yet,True,cewl and poop news more classes thou
,"Posted May 22, 2015.",,51100,No ratings yet,True,FUn but realitic as ♥♥♥♥
,"Posted December 19, 2013.",,8190,No ratings yet,True,EPIC GAME!!!
