funny,posted,last_edited,item_id,helpful,recommend,review
4 people found this review funny,Posted July 23.,,383080,3 of 3 people (100%) found this review helpful,True,Jogo Educativo e muito interessante.
,"Posted October 12, 2015.",,105600,2 of 2 people (100%) found this review helpful,True,"Terraria, it evolved much, so every major update accours each year, on June probably.This is my favorite game of my life. im glad that i buyed it. it is the best game of steam ( my opinion ), i do play everytimeThis game, is a 2D Sandbox, worth to buy it. You start with an Copper Shortsword, Copper Pickaxe and Copper Axe. 100 HP and 20 Mana. I Can tell, there is alot of youtubers that almost do only terraria videos. Examples: Yrimir, HERO, Chippygaming, TerrariaHelp, meetyourdemize, then others. You can build alot of things, and get even much stronger that you started, or even, get all of the rarest items on the game, also it has support to mods and texturepacks. I Highly Recommend this game to everyone that is thinking of buying or not."
,"Posted December 16, 2015.",,304930,1 of 1 people (100%) found this review helpful,True,"Bom Jogo, parece H1Z1 Com Graficos de Roblox, mas vale a pena, não ligo para gráficos, vivi com Super Nintendo e Consoles velhos. Otima Gameplay, Multiplayer SUAVE.A Unica coisa que falta é servidores oficiais, de pvp e pve. Para todos os países incluindo o Brasil. ( NINGUEM GOSTA DE ENTRAR EM SERVER COM MAIS DE 200 DE PING )"
,"Posted April 19, 2014.",,440,1 of 1 people (100%) found this review helpful,True,O Jogo Mais ♥♥♥♥ do Mundo
2 people found this review funny,Posted July 29.,,211820,1 of 3 people (33%) found this review helpful,True,"Muito bom adorei o jogo 69/10 melhor que assistir hentai, recomendo mt.NOICE MUSICSZ"
,Posted September 17.,,17520,No ratings yet,True,Is gud
