funny,posted,last_edited,item_id,helpful,recommend,review
1 person found this review funny,"Posted February 18, 2014.","Last edited April 12, 2015.",72850,2 of 3 people (67%) found this review helpful,True,This game was great from start to finish. 9/10p.s kill that priest in whiterun asap you wont regret it
1 person found this review funny,Posted September 10.,,337000,2 of 4 people (50%) found this review helpful,True,I enjoyed it story was a bit lacking though
,"Posted July 12, 2015.",,209160,1 of 3 people (33%) found this review helpful,False,suck my ♥♥♥♥
,"Posted February 18, 2014.",,205100,0 of 1 people (0%) found this review helpful,True,Really enjoyed it. I've replayed it so many times because of all the ways you can do missions. Its also very unique to other games and is a one of kind game. 9/10
1 person found this review funny,"Posted June 22, 2015.","Last edited June 23, 2015.",208650,5 of 22 people (23%) found this review helpful,True,Still better than arkham origins
,"Posted April 12, 2015.",,620,No ratings yet,True,It had portals and smooth jazz 10/10
