funny,posted,last_edited,item_id,helpful,recommend,review
,Posted May 31.,,70,4 of 7 people (57%) found this review helpful,True,Juegazo que marco mi infancia y la de muchos amigos con los que la pasaba horas.My Hero... λ Gordon Freeman  λ♥∞/10
,"Posted April 29, 2014.","Last edited April 29, 2014.",225260,1 of 3 people (33%) found this review helpful,True,♥ Rock and Roll ♥  Mother F***s .l. -.- .l.
,"Posted June 24, 2015.",Last edited May 23.,115320,0 of 2 people (0%) found this review helpful,True,"Tal vez igual o mejor de bueno que el Prototype™ que tambien lo jugué y complete este primero, tiene casi las mismas armas biológicas del primer protagonista algunas mejoras añadidas como 'líder de grupo'  y ' finalizadores'  entre otros mas, mejora en gráficos,historia, misiones secundarias y opcionales.Puede que sea un juego que solo te guste completarlo 1 o 2 veces.. o quizas mas.Por lo que escuche sobre los problemas de incompatibilidad con AMD, yo no tuve problemas con mi antigua tarjeta gráfica similar, ahora tengo una Nvidia.Recomiendo el juego +"
,"Posted June 17, 2015.",,203160,0 of 2 people (0%) found this review helpful,True,"Gran juego, buena historia, detalles, aventura, gráficos, trama y muchas cosas mas qu se podrían decir.Aun estoy jugandolo y fue una buena compra, aunqu' creo qu los DLC no son tan necesarios, solo compre 1.Si qu' se podría recomendar este juego.Le daría un 9/10 ^^"
,"Posted March 30, 2015.",Last edited August 14.,221380,0 of 2 people (0%) found this review helpful,True,"My first Game in Pc , a relic ♥"
