funny,posted,last_edited,item_id,helpful,recommend,review
,"Posted February 13, 2015.",,221640,No ratings yet,True,Very addictive
,"Posted October 28, 2014.",,200510,No ratings yet,True,Awesome Game.....love Strategy Game. Would highly recommend this game! :D
,"Posted September 29, 2014.",,304930,No ratings yet,True,"Awesome Game, with intersting mc effects. Could be better by having a reset world function."
,"Posted September 29, 2014.",,104900,No ratings yet,True,"Interesting Game, nice original concept. Brought together with Unreal Engine. Awesome game, would be better if I had a better PC"
,"Posted September 29, 2014.","Last edited February 17, 2015.",12830,No ratings yet,False,"Mixed. It's an alright game, with interesting ArMA like commands to troops."
,"Posted September 2, 2014.",,301520,No ratings yet,True,Awesome Game....would highly recommend it.
