funny,posted,last_edited,item_id,helpful,recommend,review
,Posted March 27.,,374570,No ratings yet,True,i laughed for the first time in forever
1 person found this review funny,"Posted June 7, 2015.",,245170,No ratings yet,True,i started playing this instead of studing for examsi regret nothing
1 person found this review funny,"Posted March 9, 2015.",,4000,No ratings yet,True,"Mods, Mods everywhere"
,"Posted February 26, 2015.",,8930,No ratings yet,True,I told myself i would only be able to play one hour of this. ended up playing 12 hours
,"Posted October 4, 2014.",,234710,No ratings yet,True,is fun
,"Posted August 22, 2014.",,304930,No ratings yet,True,dont ask. play. this. game. it has NO p2w (expet for the gold membership) there are no hidden prices in it so as i said play the game
