funny,posted,last_edited,item_id,helpful,recommend,review
2 people found this review funny,Posted May 17.,,238460,3 of 4 people (75%) found this review helpful,True,"Otimo jogo, Divertido e intereçante, um dos melhore coop."
,Posted May 18.,,233470,1 of 1 people (100%) found this review helpful,True,"Muito bom o jogo recomendo. unico ponto negativo é q ocorre muitas lutas por turno, e acaba sendo meio chato e cansativo por isso."
1 person found this review funny,"Posted July 24, 2015.",,323370,1 of 1 people (100%) found this review helpful,True,"a engine de batalhas, e os graficos são lindos, até agora estou gostando."
1 person found this review funny,Posted May 17.,,238370,5 of 9 people (56%) found this review helpful,False,"Esperava mais deste jogo, esta pior do que seu antecessor (magicka). eu jogava todo dia o magicka 1, até zerar e mesmo depois que zerei continuei jogando nas 'waves' porque era muito divertido com os amigos, mesmo no controle. quando saiu o magicka 2, logo comprei, mas no primeiro dia ja me decepcionei:* a jogabildiade está pior que do antecessor * o jogo se tornou mais complicado* as configuraçoes para controle estão piores tbbm"
2 people found this review funny,Posted May 17.,,104900,3 of 6 people (50%) found this review helpful,False,"♥♥♥♥ jogo ruim, ainda bem que paguei apenas 2 reais nele."
1 person found this review funny,Posted May 17.,,253430,3 of 7 people (43%) found this review helpful,False,"Uma cópia ruim de minecraft. no começo me intereçou bastante, parecia ter muitas coisas para se descobrir no jogo, mas não é por ae."
3 people found this review funny,Posted May 17.,,48000,2 of 5 people (40%) found this review helpful,True,"Jogo intereçante, ainda não terminei, mas até agora estou gostando, ele não tem uma historia narrada, vc vai apenas avançando cada vez mais, enfrentando fases com puzzles bem envolventes, tem um ar misterioso nesse jogo, espero que o final me surpreenda."
1 person found this review funny,Posted May 17.,,303800,8 of 25 people (32%) found this review helpful,False,Precisa de tradução para Português!.
3 people found this review funny,Posted June 13.,,378930,3 of 17 people (18%) found this review helpful,False,"Não posso recomendar esse jogo, porque nem mesmo consigui jogalo, não abre de geito nenhum, ja procurei e tentei diversas soluçoes e nada."
