funny,posted,last_edited,item_id,helpful,recommend,review
,"Posted March 7, 2015.",,206500,0 of 1 people (0%) found this review helpful,True,play it and you will love it
,"Posted February 25, 2015.",,65980,1 of 4 people (25%) found this review helpful,False,the price is to much for game like this
,"Posted February 8, 2015.",,227180,1 of 4 people (25%) found this review helpful,True,best game ever. play it !
,"Posted December 16, 2014.",,104700,No ratings yet,True,it's free why not
,"Posted December 5, 2014.",,440,No ratings yet,True,the BEST GAME EVER
