funny,posted,last_edited,item_id,helpful,recommend,review
,"Posted December 6, 2014.",,310380,8 of 12 people (67%) found this review helpful,True,"this game is really awsome, just very laggyselling copies of the game"
,"Posted June 14, 2014.",,17080,1 of 1 people (100%) found this review helpful,False,"horrible ♥♥♥♥ing game. wont even start up. no one downlaod this game, its a waste of time"
,"Posted August 18, 2012.",,730,1 of 1 people (100%) found this review helpful,True,soooooo awsome
1 person found this review funny,Posted January 30.,,252490,2 of 4 people (50%) found this review helpful,False,this game sucksrun around the entire map and your fineget attacked by a bear that spawned on you and dying is ♥♥♥♥♥♥♥tand my favourite part it that i ran to my body and it had despawned before 4 minutes wtfand you know all my guns despawn with the body but not the axedont play this game youll get cancer
3 people found this review funny,"Posted December 15, 2015.",,412470,21 of 42 people (50%) found this review helpful,True,this game is very fun. i dont see the p2w right now. i am level 5.it is a lot like wot but i love the respawning. makes dying a lot less frustrating
,"Posted August 21, 2014.",,227940,2 of 4 people (50%) found this review helpful,False,do not get this game it ♥♥♥♥en sucks in every way.
,"Posted March 8, 2015.",,99900,0 of 3 people (0%) found this review helpful,False,"♥♥♥♥♥♥ game, if you are looking for a good gme dont look at this one. 0/10 would play again"
1 person found this review funny,"Posted September 14, 2014.",,4000,1 of 10 people (10%) found this review helpful,False,if you want a game that dosnt take 5 years to load dont get this
,"Posted March 21, 2012.",,440,No ratings yet,True,this game is awsome
