funny,posted,last_edited,item_id,helpful,recommend,review
,"Posted December 3, 2014.",,34900,2 of 3 people (67%) found this review helpful,True,the cat died and den the rat laughed and then i turned off the game and then i uninstalled the game and then i died8/7wud try again
,"Posted September 17, 2014.",,40800,2 of 3 people (67%) found this review helpful,True,Mmmmmmmm Meaty
,"Posted June 23, 2014.",,620,1 of 2 people (50%) found this review helpful,True,I need the badge.
4 people found this review funny,Posted January 14.,,269030,3 of 7 people (43%) found this review helpful,True,TO THE SLUMS!
3 people found this review funny,"Posted November 26, 2015.",,249550,2 of 5 people (40%) found this review helpful,True,NEStalgia is  a game where John says he opened the one chest that had the vital quest item but in reality he never opened it and we spend an hour wandering around the cave trying to figure out where the crystal is and John is certain that he had opened the chest that had the crystal in it and John is bad.
