funny,posted,last_edited,item_id,helpful,recommend,review
1 person found this review funny,"Posted October 30, 2015.",,218620,14 of 16 people (88%) found this review helpful,False,gayday2 global offensive! As if we haven't had enough.
,Posted March 30.,,301520,5 of 7 people (71%) found this review helpful,False,pay2win
10 people found this review funny,"Posted November 17, 2015.",,302830,10 of 21 people (48%) found this review helpful,False,bad bad bad bad bad bad bad bad bad bad bad bad bad bad bad bad bad bad bad bad bad bad bad bad bad bad bad bad bad bad bad bad bad bad bad bad bad bad bad bad bad bad bad bad bad bad bad bad bad bad bad bad bad bad bad bad bad bad bad bad bad bad bad bad bad bad bad bad bad bad bad bad bad bad bad bad bad bad bad bad bad bad bad bad bad bad bad bad bad bad bad bad bad bad bad bad bad bad bad bad bad bad bad bad bad bad bad bad bad bad bad bad bad bad bad bad bad bad bad bad bad bad bad bad bad bad bad bad bad bad bad bad bad bad bad bad bad bad bad bad bad bad bad bad bad bad bad bad bad bad bad bad bad bad bad bad bad bad bad bad bad bad bad bad bad bad bad bad bad bad bad bad bad bad bad bad bad bad bad bad bad bad bad bad bad bad bad bad bad bad bad bad bad bad bad bad bad bad bad bad bad bad bad bad bad bad bad bad bad bad bad bad bad bad bad bad bad bad bad bad bad bad bad bad bad bad bad bad bad bad bad bad bad bad bad bad bad bad bad bad bad bad bad bad bad bad bad bad bad bad bad bad bad bad bad bad bad bad bad bad bad bad bad bad bad bad bad bad bad bad bad bad bad bad bad bad bad bad bad bad bad bad bad bad bad bad bad bad bad bad bad bad bad bad bad bad bad bad bad bad bad bad bad bad bad bad bad bad bad bad bad bad bad bad bad bad bad bad bad bad bad bad bad bad bad bad bad bad bad bad bad bad bad bad bad bad bad bad bad bad bad bad bad bad bad bad bad bad bad bad bad bad bad bad bad bad bad bad bad bad bad bad bad bad bad bad bad bad bad bad bad bad bad bad bad bad bad bad bad bad bad bad bad bad bad bad bad bad bad bad bad bad bad bad bad bad bad bad bad bad bad bad bad bad bad bad bad bad bad bad bad bad bad bad bad bad bad bad bad bad bad bad bad bad bad bad bad bad bad bad bad bad bad bad bad bad bad bad bad bad bad bad bad bad bad bad bad bad bad bad bad bad bad bad bad bad bad bad bad bad bad bad bad bad bad bad bad bad bad bad bad bad bad bad bad bad bad bad bad bad bad bad bad bad bad bad bad bad bad bad bad bad bad bad bad bad bad bad bad bad bad bad bad bad bad bad bad bad bad bad bad bad bad bad bad bad bad bad bad bad bad bad bad bad bad bad bad bad bad bad bad bad bad bad bad bad bad bad bad bad bad bad bad bad bad bad bad bad bad bad bad bad bad bad bad bad bad bad bad bad bad bad bad bad bad bad bad bad bad bad bad bad bad bad bad bad bad bad bad bad bad bad bad bad bad bad bad bad bad bad bad bad bad bad bad bad bad bad bad bad bad bad bad bad bad bad bad bad bad bad bad bad bad bad bad bad bad bad bad bad bad bad bad bad bad bad bad bad bad bad bad bad bad bad bad bad bad bad bad bad bad bad bad bad bad bad bad bad bad bad bad bad bad bad bad bad bad bad bad bad bad bad bad bad bad bad bad bad bad bad bad bad bad bad bad bad bad bad bad bad bad bad bad bad bad bad bad bad bad bad bad bad bad bad bad bad bad bad bad bad bad bad bad bad bad bad bad bad bad bad bad bad bad bad bad bad bad bad bad bad bad bad bad bad bad bad bad bad bad bad bad bad bad bad bad bad bad bad bad bad bad bad bad bad bad bad bad bad bad bad bad bad bad bad bad bad bad bad bad bad bad bad bad bad bad bad bad bad bad bad bad bad bad bad bad bad bad bad bad bad bad bad bad bad bad bad bad bad bad bad bad bad bad bad bad bad bad bad bad bad bad bad bad bad bad bad bad bad bad bad bad bad bad bad bad bad
2 people found this review funny,"Posted December 23, 2015.",,225600,5 of 11 people (45%) found this review helpful,False,"if you play with idiots with high pings, they're going to grapple you from 200000m away. ridiculous game, advantage to people with horrible internet"
6 people found this review funny,"Posted January 16, 2015.",,222900,2 of 7 people (29%) found this review helpful,False,No asian severs.
3 people found this review funny,"Posted December 3, 2015.",,418340,13 of 31 people (42%) found this review helpful,True,good.
,"Posted November 23, 2015.",,417860,No ratings yet,True,its hard to get into myself though
,"Posted August 18, 2015.",Last edited January 10.,730,No ratings yet,False,"Cancerous game, wanted to join competitive game but as soon as I got it I started losing connection and the game kept being unresponsive. So instead, the game decided to just give me a 30min ban. Nice!"
,"Posted May 7, 2014.",,223470,No ratings yet,True,pls you can pee on things100/10
