funny,posted,last_edited,item_id,helpful,recommend,review
,"Posted March 6, 2014.",,221100,2 of 2 people (100%) found this review helpful,True,Got my pants stolen by a bandit and then got ♥♥♥♥♥ 11/10 would play again
2 people found this review funny,"Posted June 16, 2015.","Last edited June 16, 2015.",346110,3 of 4 people (75%) found this review helpful,True,"I tamed a dodo he was my best friend, we did everything togther we watched movies and sang songs but that all changed one day as my food meter reached zero i had no choice.....at least he was dam tastyPet Eating Simulator 10/10"
,"Posted June 20, 2014.",,570,1 of 1 people (100%) found this review helpful,True,teh best game hands down!
,"Posted September 15, 2015.","Last edited September 15, 2015.",236390,1 of 2 people (50%) found this review helpful,True,Taught those nazis a thing or two or ten*Drops more bombs*
,"Posted December 26, 2014.",,227300,No ratings yet,True,"The graphics are amazing, i love the game mechanics and how they fit witht he real world type scenarios making this game one i will play for a long time :D 10/10"
,"Posted October 24, 2014.",,223710,No ratings yet,True,Its Anal ravaging
,"Posted October 24, 2014.",,242760,No ratings yet,True,*Running away from spooky creatures*''ill be safe in the water**Gets but-♥♥♥♥ed by shark*11/10
,"Posted June 26, 2014.",,200710,No ratings yet,True,Could turn a corgi into a fish in less then 0.11 seconds  11/10
