funny,posted,last_edited,item_id,helpful,recommend,review
,"Posted August 30, 2015.",,388520,No ratings yet,False,"IF I SPENT 60 EUROS FOR A GAME, I DONT WANNA PLAY VS. CHEATER KIDS !!!"
,"Posted October 21, 2014.",,224600,No ratings yet,True,"Defiance is a great Sci-Fi MMO, where you can find many Sci-Fi Fans. You can watch the Defiance Season on TV too.  There are no Differents between the Game and the Movie. Just amazing stuff. Take a look at this Game. You will like it ;-)"
,"Posted June 6, 2014.",,213850,No ratings yet,True,Great Game. Dont forget to play it ;-)
,"Posted May 28, 2014.",,107410,No ratings yet,True,"If you have played 'Arma 2: Free', you wil love this new Version 'Arma 3' of the Military Game Series from the Developer and Publisher 'Bohemia Interactive'.This Game combines Action, Simulation and Strategy. You can play as Single Player, Co-Op, and Multiplayer. Its just a great Game. Dont miss it ;-)Real Soldiers can use this Game very good for simulated Training."
,"Posted May 28, 2014.",,70000,No ratings yet,True,Dinos meets Nazis ;-)
,"Posted May 28, 2014.",,104900,No ratings yet,True,Action and Adrenaline pur ;-)
,"Posted May 28, 2014.",,215470,No ratings yet,True,"Roar !!! ;-) If you like Dinos, Jurassic Park and Teamwork, you will love this Game."
,"Posted May 5, 2014.",,234330,No ratings yet,True,This Game is good for your Brain and makes Fun ;-)
,"Posted December 14, 2013.",,570,No ratings yet,True,This Game makes Fun. Just take a look ;-)
,"Posted December 31, 2012.","Last edited November 25, 2013.",218230,No ratings yet,True,Zurecht hat dieses Spiel den Titel 'Bestes Multiplayerspiel 2012' gewonnen. ;-)
