funny,posted,last_edited,item_id,helpful,recommend,review
,"Posted January 15, 2014.",,200210,3 of 3 people (100%) found this review helpful,False,"was such a great game till Kabam bought the game and became money hungry, now all you need is money to have the best gear and be the strongest. DONT PLAY IT, DONT WASTE UR TIME!"
1 person found this review funny,"Posted November 3, 2015.",,219150,1 of 1 people (100%) found this review helpful,True,i cri evrytiem i finsh dis game
1 person found this review funny,"Posted November 15, 2015.",,332500,3 of 5 people (60%) found this review helpful,True,"well its free, so u cant go wrong but even if it wasnt u wouldnt go wrong, this is a supper fun game especially if you play with mates would highly recommend it and its only Early access."
1 person found this review funny,Posted April 1.,,413150,1 of 2 people (50%) found this review helpful,True,'Don't talk to me right now.'10/10 Would get neglected by Shane again.
,"Posted October 7, 2015.",,233450,1 of 2 people (50%) found this review helpful,True,plox can someone tech me how to play?
,Posted July 7.,,491260,1 of 4 people (25%) found this review helpful,True,:csdsmile:
