funny,posted,last_edited,item_id,helpful,recommend,review
,"Posted April 5, 2014.","Last edited April 20, 2014.",20,No ratings yet,True,Fun Game. I Feel It Handles Lag Better Than Tf2. TF2 Is Still A Great Game Though.
,"Posted February 1, 2014.","Last edited December 15, 2014.",730,No ratings yet,True,"I Had Fun Playing it while i was not playing tf2 (and l4d2) But Going Online Is Too Hard I get owned. Lol[Edit] Now I have gotten a bit better, fun to play with people, I only run into dickbags every 5 matches."
,"Posted January 5, 2014.",,239820,No ratings yet,True,Great Game I Have A Tone Of Fun Playing This :) (Like TF2 Fun)
,"Posted April 5, 2013.",,1840,No ratings yet,True,Great For Making Movies But Hard To Learn How To LOL
,"Posted November 26, 2012.",,4000,No ratings yet,True,i think it is the best
