funny,posted,last_edited,item_id,helpful,recommend,review
,Posted August 28.,,304050,1 of 2 people (50%) found this review helpful,False,The Devs of This game are Complete ♥♥♥ Wipes.
,"Posted May 31, 2015.",,236390,1 of 2 people (50%) found this review helpful,True,One of My fav games
1 person found this review funny,"Posted May 31, 2015.",,271590,1 of 3 people (33%) found this review helpful,True,"Great Game,Very fun with friends and an all round classic."
,"Posted June 8, 2014.",,218230,No ratings yet,True,Awesome game!!! Love it!!!
,"Posted May 23, 2014.",,107410,No ratings yet,True,Good game iff u like wastland or life servers=)
