funny,posted,last_edited,item_id,helpful,recommend,review
8 people found this review funny,"Posted May 23, 2015.",,351290,10 of 11 people (91%) found this review helpful,True,Dayz - zombies + russians= Survival: Postapocalypse Now
,"Posted October 23, 2015.",,410680,7 of 14 people (50%) found this review helpful,True,The artwork and the sounds are amazing! An amazing game!
,"Posted September 11, 2014.",,322010,11 of 27 people (41%) found this review helpful,True,Love it to bits!
,"Posted June 25, 2015.",,312990,No ratings yet,True,"From BROBOCOP to an Indiana Jones rip off you will have a 11/10 experience murcelessly killling people while screaming, 'MURICA F$%# YEA'"
,"Posted December 25, 2014.",,304930,No ratings yet,True,"Awesome I love it to bits, I wish people were more Friendly, Would save me alot of times saying *are you friendly*?"
