funny,posted,last_edited,item_id,helpful,recommend,review
,"Posted March 8, 2015.",,354140,No ratings yet,True,"if you guys know the story, you will see that is more bizarre than the game itself 10/10 (contains 2 final, good and bad ending ending) 95% of difficulty getting good endind"
,"Posted March 7, 2015.",,332800,No ratings yet,True,esc simulator 10/10
,"Posted November 2, 2014.",,319510,No ratings yet,True,"quer se cagar de medo,quer ter o coração na mão,compre esse joguinho maravilhoso de jesus"
,"Posted August 16, 2014.",,400,No ratings yet,True,um jogo perfeito para quebrar a cabeça com os puzzles rsrs.tambem com uma trilha sonora otima.10/10
,"Posted July 2, 2014.",,252490,No ratings yet,True,um ÓTIMO jogo para jogar com os amigos :D
,"Posted December 26, 2013.",,550,No ratings yet,True,"jogo mt epico,e legal,:3"
