funny,posted,last_edited,item_id,helpful,recommend,review
3 people found this review funny,"Posted August 29, 2015.","Last edited August 29, 2015.",344750,1 of 10 people (10%) found this review helpful,True,"This game gave me deadly profits, if you know what I meanBebz ( ͡~ ͜ʖ ͡°)"
,"Posted December 13, 2015.",,368900,No ratings yet,True,Thanks for another great game Zonitron!
,"Posted September 23, 2015.",,398710,No ratings yet,True,"Great game, very simple.It's a shame other developers are now trying to make copy-pastes of this and then those are getting on steam."
,"Posted March 24, 2014.","Last edited August 22, 2015.",107410,No ratings yet,True,"This game is funAlthough, it is pay-to-win.I bought this game a long time ago, yet I am spammed with advertising whenever I choose to use a gun although someone that bought the game + all dlcs while it was on sale for a fraction of what I payed can get them all with no advertisments, at all times.Come on, I bought the 'digital deluxe' version of this when it was in alpha, and now all I cop is idiots with the new light machine guns, that one hit kill to the chest, and are incredibly accurate.I feel that we should at least be able to use the guns, just with low quality textures (such as what happened in arma 2), as this is an unfair advantage to those who bought the game on sale, and disadvantages those who chose to support the game in early stages."
,"Posted January 22, 2014.",,72850,No ratings yet,True,"A Nice looking Sandbox Game with lots of mods,I reccomend buying it"
