funny,posted,last_edited,item_id,helpful,recommend,review
,Posted August 18.,,359320,5 of 7 people (71%) found this review helpful,True,Top notch space game game for 200 hours before it gets kinda grindy. Great community. Be sure to join a squad to ease the loneliness- they'll keep you in the game. Must have experience!
1 person found this review funny,Posted July 3.,,730,1 of 1 people (100%) found this review helpful,False,Toxic community second only to rust
,Posted June 30.,,105450,1 of 1 people (100%) found this review helpful,True,One of the best RTS games I've ever played. Got both the macro and micro aspects downpat 10/10.
,"Posted December 17, 2013.",,209540,1 of 1 people (100%) found this review helpful,True,"Awesome game. Just a bit buggy though, takes 15 mins to start lol."
1 person found this review funny,Posted June 19.,Last edited June 19.,210770,0 of 1 people (0%) found this review helpful,True,"The best co-op shooter I've ever played, good with friends but beware of toxic strangers>Joins random public game (hosted by people who want their game to be private but are too dumb to set it)>Cops abuse from some players to gtfo>Chooses battle rifle as secondary>Blasts these players off the map>Gets banned10/10 would recommend wrecking dumb toxic ♥♥♥♥s. This game actually gives you the option to do so."
1 person found this review funny,Posted June 30.,,252490,0 of 2 people (0%) found this review helpful,False,The chat gave my eyes cancer10/10 most carcinogenic community I've ever been exposed to
,Posted February 17.,Last edited June 26.,225540,No ratings yet,True,"I absolutely love this game. No issues on my side with a GTX670- just pure ♥♥♥♥♥♥♥♥ physics and mayhem. Great game for friend meetups, to take turns as Rico and laugh at the hilarious things that happen often. 10/10 superb open world game"
