funny,posted,last_edited,item_id,helpful,recommend,review
,"Posted November 28, 2015.",,323500,17 of 21 people (81%) found this review helpful,False,"A DLC em si, e boa sim, o fato que me deixou muito P U T O com ela é as mascaras é do Personagem Jimmy, eles vem nessa DLC, mas para você jogar com ele você tem que ter Na sua Biblioteca Steam O Hotline Miami 2, então veja bem, você tem que pagar por uma DLC e um jogo, isso achei uma P U T A sacanagem dos produtores do jogo, Mas a DLC em si é bem legal."
,"Posted January 1, 2015.",,200260,7 of 8 people (88%) found this review helpful,True,"Hoje dia 1º de janeiro foi o dia em que zerei Batman, o que posso dizer sobre esse jogo....É simplesmente fantático um dos melhores jogos que joguei na minha vida, uma hostória incrivel ,personagens , tudo.esse jogo é simplesmente um presente a todos os fâs de Batman, realmente valeu cada centavo que gastei, é simples mente fantástico, é mais que recomendado é obrigação de todos os fâs de Batman jogarem esse jogo."
,"Posted February 9, 2014.",,550,2 of 3 people (67%) found this review helpful,True,"Um dos melhores jogos da steam, vale muito a pena comprar !"
,"Posted December 17, 2013.",,630,1 of 3 people (33%) found this review helpful,True,"Um jogo bem legal um ótimo RPG, vale apena mesmo baixar Super Recomendado"
,"Posted February 20, 2014.",,223470,0 of 1 people (0%) found this review helpful,True,"Um dos jogos que mais gostei, totalmente politicamente incorreto com muito mais muito humor negro, recomendo para a queles que buscam um jogo de ação aventura e muita mais muita Violência !!!!!!!!!!!!!"
,"Posted January 16, 2014.",,206210,0 of 1 people (0%) found this review helpful,True,Jogo muito bom Recomendo
,"Posted December 7, 2014.",,24240,No ratings yet,True,"Jogo muito bom, um excelente jogo pra jogar como os amigos"
