funny,posted,last_edited,item_id,helpful,recommend,review
,Posted February 8.,,211420,No ratings yet,True,Addicting and maddening.  makes me foam at the mouth.
,Posted February 8.,,271590,No ratings yet,True,genodcide simulator 2016
,Posted February 8.,,313740,No ratings yet,True,friend made me play this at gunpoint.  help me...
1 person found this review funny,"Posted October 1, 2014.",,22380,No ratings yet,True,It's like youre own personal school shooting.  kill everything.
,"Posted August 28, 2014.",,312990,No ratings yet,True,This game is Brotastic!  It's fourth of july everyday when you're playing expendabros!  AMERICA ♥♥♥♥ YEAH!
