funny,posted,last_edited,item_id,helpful,recommend,review
,Posted March 15.,,310380,1 of 1 people (100%) found this review helpful,True,"Definitely recommend buying this game, Super Hella Fun"
,Posted January 13.,,304930,No ratings yet,True,tbh the character models are too huge.. but it's a good game...my only con is just that the character model and probably the hands are huge
,Posted January 11.,,107410,No ratings yet,True,My computer can't handle it11/10
,"Posted March 8, 2014.",,271290,No ratings yet,True,"Hawken and Titanfallgreat mech games, totally recommend it"
,"Posted January 16, 2014.",Last edited January 9.,211820,No ratings yet,True,"It's like Destiny, but side scrolling.like terraria with infinite ammo.like Minecraft-ishLike Edge Of Space, but more.. cleaner look? yeaha few crashes here and there but definitely a good buy"
,"Posted November 30, 2013.",,206420,No ratings yet,True,"If you want some goofy stuff, buy thisIf you want something GTA like, buy that or Saints Row The Third"
