funny,posted,last_edited,item_id,helpful,recommend,review
,Posted August 28.,,344040,1 of 2 people (50%) found this review helpful,True," Jogo tem futuro, ignorem essas analises ♥♥♥♥♥♥♥♥♥s que o jogo ainda esta em sua 1 versão da beta..."
,"Posted June 1, 2015.","Last edited June 1, 2015.",333980,1 of 2 people (50%) found this review helpful,True,"Muito bem optimizado para o PC (Só falta rodar a 60fps pq roda a 30) ... e sensacional! Só não gostei de jogar no teclado, recomendo jogar essa dlç no controle."
1 person found this review funny,"Posted December 18, 2014.",,234670,0 of 1 people (0%) found this review helpful,True,Mal optimizado mais blz o jogo esta bem jogavel. Se vc curte 60 Frames esquece esse jogo... Eu tenho 2 placas de video e digo que se vc tem uma Intel HD 4000 vc consegue jogar com uma taxa de 20-25 frames  ja com uma  Nvidia GeForce GT 740M vc joga liso sem lag algum <3
,"Posted December 15, 2014.",,49520,0 of 1 people (0%) found this review helpful,True,♥♥♥♥ '-'
,"Posted November 14, 2014.",,24240,0 of 1 people (0%) found this review helpful,True,F-O-D-A! Mais ainda prefiro o 2 :P
,"Posted September 24, 2014.",,440,0 of 1 people (0%) found this review helpful,False,Esse jogo deveria ser pago pois há pessoas entrando nos servers o tempo inteiro é um inferno... se o jogo fosse pago iria ser uma beleza.... sem falar dos bugs né.
2 people found this review funny,"Posted September 29, 2014.",,620,4 of 79 people (5%) found this review helpful,False,O jogo em si é bom eu adorei... Porem só pude joga-lo uma vez pq ele quando termina de carregar o mapa ele fecha do nada...
