funny,posted,last_edited,item_id,helpful,recommend,review
1 person found this review funny,"Posted March 20, 2015.",,356380,18 of 21 people (86%) found this review helpful,True,A relaxing indie game with soft ambient music. Play it while queuing for another game or to simply chill out and have some fun
,"Posted November 22, 2015.",,417860,No ratings yet,True,I hear you like friendzone
,"Posted January 19, 2015.",,239820,No ratings yet,True,Met and beat my expectations. Challenging and fun with heaps of replayability. If you value the historical journey of the video gaming industry then this is definitely a title you'll be looking to pick up and play. 
,"Posted February 6, 2014.","Last edited February 9, 2014.",221910,No ratings yet,True,"Blew my mind, worth every dollar/penny/pound/euro!! One of if not the best game to come out of 2013. An approach taken that I have not seen in a video game before. Your sanity will be tested in this short but extremely fun title. If you haven't bought it, if you haven't played it, then we simply can't be friends."
,"Posted August 23, 2013.",,236390,No ratings yet,True,"Fanstatic Game! Great attention to detail, 10/10!!"
,"Posted December 4, 2012.",,570,No ratings yet,True,"VERY steep learning curve but once you've mastered the basics and understand what's going on, you'll play for hours and love every second of it. Definitely Recommended!!"
,"Posted July 22, 2012.",,49600,No ratings yet,True,"Best. Indie. Game. Ever. Buy, Buy, Buy!! :D"
,"Posted July 18, 2012.",,440,No ratings yet,True,"Massively Multiplayer, Lots of Addons/DLC and 9 different classes to choose. Oh did I mention IT'S FREE!!! Download and play....nuff said."
