funny,posted,last_edited,item_id,helpful,recommend,review
172 people found this review funny,"Posted January 22, 2015.",,260230,107 of 138 people (78%) found this review helpful,True,this game touched me like a priest touches a young boy10/10 i cry erry time
,"Posted October 20, 2015.",,235540,3 of 6 people (50%) found this review helpful,True,thanks Fatshark I now have a gambling addiction.must.... roll..... dice....
,"Posted December 31, 2015.",,330840,0 of 1 people (0%) found this review helpful,True,buy this game if you wish to spend 10 hours of your life simulating the pain of losing everyone you care about
,"Posted October 21, 2015.",,330830,No ratings yet,True,finger guns. pew pew pew9/10
,"Posted December 29, 2013.",,8930,No ratings yet,True,Probably the best modern turn-based strategy game.Interesting and enjoyable.8/10
,"Posted December 29, 2013.","Last edited June 22, 2014.",219640,No ratings yet,True,10/10 would taunt again
