funny,posted,last_edited,item_id,helpful,recommend,review
4 people found this review funny,Posted January 31.,,310380,8 of 11 people (73%) found this review helpful,True,It was free10/10 would buy again
,Posted August 30.,,227940,2 of 5 people (40%) found this review helpful,False,Scammers man
,Posted August 13.,,265930,No ratings yet,True,Only the strongest will survive.....not you! The goats for ♥♥♥♥ sake7/10
,Posted August 13.,,275850,No ratings yet,False,"♥♥♥♥. Pretty boring and unoptimised, I expected muiltplayer and got straight up jacked. Quality indie games, amirite."
,"Posted February 10, 2015.",,730,No ratings yet,True,Get shot from across the map by a AK10/10
