funny,posted,last_edited,item_id,helpful,recommend,review
,"Posted April 4, 2014.",,440,2 of 2 people (100%) found this review helpful,True,"hands down best free to play game on steam, once u pick this up you would not see the sunshine again! welcome to the dark side :P"
,"Posted April 4, 2014.",,730,2 of 2 people (100%) found this review helpful,True,"good game to play, except for getting spawn killed lol"
,"Posted December 13, 2013.","Last edited September 22, 2014.",238960,2 of 3 people (67%) found this review helpful,True,"Great Game, however should be available on Mac!!!"
,"Posted April 18, 2014.","Last edited August 2, 2014.",8870,No ratings yet,True,"Awesome game, ate a potato from the toilet lol. and best ending ever wow!!"
,"Posted April 4, 2014.",,209270,No ratings yet,False,"takes a long time to finish each matches, and anyways im just here for the tf2 items lol"
