funny,posted,last_edited,item_id,helpful,recommend,review
,Posted February 8.,,220,1 of 1 people (100%) found this review helpful,True,"Um clássico! finalmente pude experimentar de perto essa obra prima da Valve, me impressionaram com os gráficos, jogabilidade nova, e a sem falar na história magnífica que a franquia Half life possui. Simplismente uma lenda esse game, recomendadíssimo!"
1 person found this review funny,"Posted January 23, 2015.",,335330,2 of 5 people (40%) found this review helpful,False,So ♥♥♥♥♥♥ Crashed Game
,"Posted February 17, 2015.",,302830,0 of 1 people (0%) found this review helpful,False,"Primeira vez o jogo é legal , depois... se torna uma ♥♥♥♥♥, Trava muito, não tem server br e etc.. simplismente o jogo foi cagado."
,"Posted June 15, 2014.",,206210,0 of 1 people (0%) found this review helpful,True,Jogo ♥♥♥♥ !
,Posted February 8.,Last edited February 8.,400,No ratings yet,True,"Ótimo jogo! achava que era chato, mas com a promoção pude experimentar, tem uma história boa, divertido, puzzles, e sentinelas fazendo com que você quebre a cabeça tentando achar a melhor forma de ficar vivo, sem falar na personagem Glados, que acabei de conhecer, e ja gosto dela pakas. Acabei de zerar. #PartiuPortal2"
,"Posted September 25, 2013.",,440,No ratings yet,True,É o melhor jogo do MUNDOO GRÁTIS!!! ^^
