funny,posted,last_edited,item_id,helpful,recommend,review
,"Posted June 27, 2015.",,317400,1 of 1 people (100%) found this review helpful,True,best portal mod ever
,"Posted May 24, 2015.",,252530,3 of 5 people (60%) found this review helpful,True,best game ever if you like bus hk west  so good
,"Posted May 22, 2015.",,730,1 of 2 people (50%) found this review helpful,True,nice game if you are no a cod or bf playerneed to have mic
,"Posted June 20, 2015.",,271590,2 of 5 people (40%) found this review helpful,True,nice game if you have a good computer
,"Posted September 21, 2015.",,218620,0 of 1 people (0%) found this review helpful,False,TOO MANY ♥♥♥♥♥ DLC DONT BUY SAVE UR MONEY TO BUY BETTER GAMES
1 person found this review funny,"Posted June 5, 2015.",,301760,3 of 11 people (27%) found this review helpful,False,bad game DONT BUY
