funny,posted,last_edited,item_id,helpful,recommend,review
23 people found this review funny,"Posted November 15, 2015.",,251310,14 of 29 people (48%) found this review helpful,True,Walking-slowly-like-a-crippled-old-man sim 2015.
4 people found this review funny,"Posted July 16, 2015.",,42160,6 of 13 people (46%) found this review helpful,True,"You dont play it to be good at it, you just play it to see how dumb people can be and laugh at how broken the game isAll in all grab a few friends play together and have a good timethats what i did :P"
4 people found this review funny,"Posted January 28, 2015.","Last edited January 28, 2015.",258950,6 of 14 people (43%) found this review helpful,True,"Stiltzkin: montagues mount?Stiltzkin: are you mounting gays again?-AoG-SHARKE BYTE [FYG]: It's a great game-AoG-SHARKE BYTE [FYG]: you would like it-AoG-SHARKE BYTE [FYG]: Montague's Mount is disturbing psychological thriller set in the bleakness of an abandoned Irish island, featuring exploration and challenging puzzle solving. This game is part one of a two part story, some questions are left unanswered and open to interpretation.-AoG-SHARKE BYTE [FYG]: http://steamcommunity.com/app/258950-AoG-SHARKE BYTE [FYG]: my worst challenge so far is not being able to use my ♥♥♥♥ing compass-AoG-SHARKE BYTE [FYG]: sigh, such is life as a pc gamer -AoG-SHARKE BYTE [FYG]: http://steamcommunity.com/id/Terminally-Chill/recommended/258950-AoG-SHARKE BYTE [FYG]: you're famous bbyStiltzkin: how ♥♥♥♥♥♥♥♥Stiltzkin: thats not a reviewStiltzkin: how is that a reviewStiltzkin: havent you learend anything in school-AoG-SHARKE BYTE [FYG]: I learned you hate indie game devs-AoG-SHARKE BYTE [FYG]: there-AoG-SHARKE BYTE [FYG]: updated it for youStiltzkin: i could just goStiltzkin: and take it downStiltzkin: and say to gaben-AoG-SHARKE BYTE [FYG]: you monsterStiltzkin: i dont want my name in there-AoG-SHARKE BYTE [FYG]: you better not mark that ♥♥♥♥ as 'funny'-AoG-SHARKE BYTE [FYG]: this is a serious reviewStiltzkin: i gave it a thumbs downYOU MONSTER"
11 people found this review funny,"Posted July 16, 2015.",,284930,5 of 13 people (38%) found this review helpful,True,If my driving skills in real life are as bad as in this game I'm definitely going to be screwed in the future! :/
6 people found this review funny,"Posted September 11, 2015.",,399790,33 of 75 people (44%) found this review helpful,True,"Destiny Warriors is a fantastic RPG spin-off with a uniqe take on the 'Save the world' genre so many of us love.You start as a school boy in a small town who has almost completed his ninja training, while it's hard to go into too much detail without spoiling the plot it's quite fun, as you explore more levels you can also upgrade your equipment/stats and keep your favorite items in your inventory.Overall score: ★★★★★ out of ★★★★★ stars!Story: 10/10Graphics: 9/10Gameplay/mechanics: 10/10 (Has a very nice feel to the inventory/equipment managment which I like).Combat Mechanics: 10/10 (Very well done inventory/items/stat management)Music/sound: 9/10"
7 people found this review funny,"Posted August 17, 2015.","Last edited August 17, 2015.",325110,3 of 13 people (23%) found this review helpful,True,Gotta save them all!
7 people found this review funny,Posted April 23.,,446470,4 of 17 people (24%) found this review helpful,True,NEW YORK NAZI SIMULATOR 2016
