funny,posted,last_edited,item_id,helpful,recommend,review
155 people found this review funny,"Posted February 19, 2015.",,298630,80 of 105 people (76%) found this review helpful,True,I dropped the soap and got an achievement.
,"Posted June 10, 2013.",,105600,No ratings yet,True,"It's a lot like Minecraft, but it's turning out to be a lot better than it to! More adventerous, side scrolling and more enemys, items and blocks!"
,"Posted January 1, 2012.",,22380,No ratings yet,True,"Great Sandbox Game! I can just about go anywhere, and do anything from murdur to steal or rescue to sell!"
,"Posted July 3, 2011.",,320,No ratings yet,True,Preaty fun online shooter.
,"Posted July 1, 2011.",,440,No ratings yet,True,A comedy fest of blood and gore!
