funny,posted,last_edited,item_id,helpful,recommend,review
1 person found this review funny,Posted August 23.,,223710,1 of 2 people (50%) found this review helpful,True,it made me pogchamp pretty hard
2 people found this review funny,Posted May 15.,,379720,2 of 4 people (50%) found this review helpful,True,"this game is ♥♥♥♥ing incredible, worth the $50"
,Posted February 7.,,730,0 of 1 people (0%) found this review helpful,False,"game has turned to absolute bu7tt cancer, matchmaking has been ruined by smurfs and an unreliable mm system, would not play, save the money, don't be lured by the skins"
,"Posted December 10, 2015.",,232090,0 of 3 people (0%) found this review helpful,True,"10/10, game runs very smoothly and is great fun to play"
,"Posted December 2, 2014.",,17500,No ratings yet,True,Amazing
,"Posted October 24, 2014.",,1250,No ratings yet,True,"amazing game, spent countless hours nerding this beautiful game :)"
