funny,posted,last_edited,item_id,helpful,recommend,review
,"Posted October 18, 2014.",,263280,1 of 3 people (33%) found this review helpful,True,very fun game recommend it verg good graphics and lots of fun
,"Posted July 5, 2015.",,107410,No ratings yet,True,"awsome game,one of the reasons i like it is because you can drive vehicles which you cant in manty games i definetly recommend this game"
,"Posted December 2, 2014.",,206210,No ratings yet,True,"it is fun and funny, an amazing multiplayer game against bats and jokers"
,"Posted October 2, 2014.",,113400,No ratings yet,True,good/dun game
,"Posted April 14, 2014.",,72850,No ratings yet,True,really fun with action and adventure get thousands of items and very very fun game with dragons and monsters and of course people
