funny,posted,last_edited,item_id,helpful,recommend,review
5 people found this review funny,"Posted January 28, 2015.",,211420,30 of 37 people (81%) found this review helpful,True,Greatest game ever 10/10
,"Posted July 12, 2015.",,274940,2 of 3 people (67%) found this review helpful,True,Soooooo bloody good
,"Posted June 9, 2014.","Last edited January 30, 2015.",236430,2 of 3 people (67%) found this review helpful,True,"best game everyou can hop into a coffin which gives you a mans head on a womans bodyalso, you can punch dragons in your underwear"
1 person found this review funny,"Posted January 30, 2015.",,42160,1 of 2 people (50%) found this review helpful,True,this game cops a lot of criticism but is still one of the BEST melee combat systems ever. too much fun.
,Posted February 19.,,234530,0 of 3 people (0%) found this review helpful,False,Fails to launch due to EAC problems. Support thread no help. 0/10. Broken game. Avoid.
,"Posted July 5, 2015.",,300380,1 of 7 people (14%) found this review helpful,False,No online multiplayer :(
,"Posted July 1, 2015.",,313120,No ratings yet,True,Great game. Runs smooth on my crappy low end pc. Lot's of fun to be had killing marine life and looking for coconuts. Add a multiplayer and I will score 10/10.
,"Posted June 27, 2014.",,35720,No ratings yet,True,such a great game
,"Posted October 12, 2013.","Last edited May 17, 2014.",219640,No ratings yet,True,awesome fun. brutal combat
