funny,posted,last_edited,item_id,helpful,recommend,review
,"Posted September 6, 2015.",,730,No ratings yet,True,Эта игра является довольно прохладно :)
,"Posted June 6, 2015.",,333930,No ratings yet,True,:)
,"Posted May 10, 2015.",,230410,No ratings yet,True,Pew Pew :D
,"Posted May 8, 2015.",,113400,No ratings yet,True,Havent Played it yet :)
,"Posted April 15, 2015.",,218620,No ratings yet,True,"Sweet action packed game about stabbing people, stealing, blowimg up and stealthing.69/21 would bang again"
,"Posted August 7, 2014.",,301520,No ratings yet,True,"This game is aweosme, it doesnt need you to spend money just to play like other games do. I Totally recommenf this :D"
,"Posted June 24, 2014.",Last edited July 8.,440,No ratings yet,False,"You Have To pay $10 to play competitive, Valves Running out of money."
,"Posted September 6, 2013.",,236390,No ratings yet,True,Its  An Awesome War game thet actually puts you in in the cockpit of the plane......hehe cockpit
