funny,posted,last_edited,item_id,helpful,recommend,review
,"Posted April 30, 2014.",,280930,2 of 3 people (67%) found this review helpful,True,An addicting game with a unique play style. Definitely worth checking out!
,"Posted March 13, 2015.",,730,2 of 4 people (50%) found this review helpful,True,Najlepszy program na Steamie do nauki rosyjskiego
2 people found this review funny,Posted January 2.,,203630,2 of 5 people (40%) found this review helpful,True,It's Civilization V with a little more dragons and magic on it.9.5/10
1 person found this review funny,"Posted August 17, 2015.",,8930,No ratings yet,True,Polecam
,"Posted June 7, 2014.","Last edited March 8, 2015.",246280,No ratings yet,True,To jedna z najlepszych gier w jakie grałem na xboxie.Jej miejsce jest na ekranie TV a nie PC.
,"Posted April 25, 2014.",,239800,No ratings yet,True,This game it's really good.
,"Posted April 13, 2014.",,235250,No ratings yet,True,+ jedna z lepszych tower defense w jakie grałem+ skile i ekonomia+ trudna+ długa
