funny,posted,last_edited,item_id,helpful,recommend,review
,"Posted March 9, 2015.",,55230,No ratings yet,True,walking around with a giant purple ♥♥♥♥♥ that i can wack po-po with10/10 would bang police with a ♥♥♥♥♥ again
,"Posted January 19, 2015.","Last edited July 19, 2015.",730,No ratings yet,True,"but wait. counter strike has 3 versions. cs 1.6, css and csgo. clearly gaben doesnt hate 3. HL3 CONFIRMED.seriously when do we get hl3?"
,"Posted January 17, 2015.","Last edited January 25, 2015.",206420,No ratings yet,True,steal a car then save it to my phone 10/10 would steal a car again
,"Posted September 12, 2014.","Last edited November 26, 2014.",204300,No ratings yet,True,good game lots of fun offline is still as fun as online.hard to find a game of 3v3 normaly i just get paired with bot and vs 1 other live playergood to play with friends though
,"Posted September 7, 2013.",,105600,No ratings yet,True,fun game thx summer sale 2013
