funny,posted,last_edited,item_id,helpful,recommend,review
1 person found this review funny,"Posted May 5, 2015.",,1520,2 of 3 people (67%) found this review helpful,True,♥♥♥♥ing missiles everywhere and I have no ♥♥♥♥ing clue what to do but I love it
,"Posted May 5, 2015.",,44200,0 of 1 people (0%) found this review helpful,True,Flew spaceships into my enemies planets99999/10
,Posted September 5.,,48700,No ratings yet,True,"If you enjoy starting from scratch, killing hundreds of enemies on the battlefield, commanding armies of thousands, building your own empire or just doing whatever you want in a medieval sandbox then this game will never let you sleep again."
,"Posted May 5, 2015.",,35480,No ratings yet,True,I don't even know what the ♥♥♥♥ I'm doing
,"Posted May 5, 2015.",,298630,No ratings yet,True,"Stole gaurds dirty laundry, tried to escape by shoveling underground, ended up trapping myself in infirmary.1000/10"
,"Posted May 5, 2015.",,227940,No ratings yet,True,"Shot enemy, they shot back, I died10/10"
,"Posted May 5, 2015.",,6860,No ratings yet,True,its good guys i swear
