funny,posted,last_edited,item_id,helpful,recommend,review
,"Posted November 22, 2015.",,417860,No ratings yet,True,Even in games I'm meant to be forever alone :/10/10
,"Posted November 10, 2015.",,319630,No ratings yet,True,This game is a masterpiece.
,"Posted October 14, 2015.",,233450,No ratings yet,True,"After hours of creating my very own prison, a fire starts in the kitchen.I got so ♥♥♥♥♥♥ i initiated a lockdown trapping 85 staff, 50 prisoners and at least 5 visitors.Now i am facing ten years for criminal negligence.10yrs/10 would do that again"
,"Posted July 7, 2015.",,351640,No ratings yet,True,"Although i havent finished it just yet i can say that this game is one of the best free rpgs ive played.Good plot, Story rich and a nice and simple gameplay.It's also free so yeah no ragrets!"
,"Posted July 6, 2015.",,570,No ratings yet,True,At first i was like'Im not gonna buy sets or items its waste'But then'Hmm that looks nice oh and that too' i honestly cant stop getting them now.
,"Posted June 9, 2015.",,282900,No ratings yet,True,"This game is straight up awesome! Gameplay is fun, Extremely likable characters and the story is full on amazing!Not to mention a variety of waifu choices! "
,"Posted June 9, 2015.",,313730,No ratings yet,True,i love this game it has that aldnoah.zero feel to it if u like VNs and is a strategist like me i reckon you would like this one besides its free!
,"Posted June 8, 2015.",,363970,No ratings yet,True,1.Open game2.Set to lvl that drops a ton of gold3.Go to work4.Come back5.Dont even need to click lolseriously though im just lazy 
