funny,posted,last_edited,item_id,helpful,recommend,review
,"Posted May 24, 2014.",,12120,1 of 1 people (100%) found this review helpful,True,Still the best GTA game only this time you can have slightly better graphics and install Winnie The Pooh mods for your kids to play10/10
,"Posted September 4, 2014.",,270170,1 of 2 people (50%) found this review helpful,False,even before the whole 'Zoe Quinn' saga i still thought this game was ♥♥♥♥
,"Posted May 24, 2014.",,225140,No ratings yet,True,This game has a strip club11/10
,"Posted May 24, 2014.",,211600,No ratings yet,True,Spent the whole first mission throwing vases and plates at guards10/10
,"Posted May 11, 2014.",,42910,No ratings yet,True,i killed my friend with a rock10/10 GOTY
,"Posted February 15, 2014.",,223470,No ratings yet,True,One of the best games ever made sure it has problems but what game doesnt its nothing but violent fun which is what all video games should be FUN never before has a game made me giggle like a little girl as i ♥♥♥♥ in peoples mouths only to see them puke on the ground i reccomend this game to anyone who wants FUN
