funny,posted,last_edited,item_id,helpful,recommend,review
,"Posted May 22, 2014.",,243870,4 of 5 people (80%) found this review helpful,True,"I would recommend this game for 2 reasons, one: because its fast-paced and two: it has great graphics. Give the game a try."
,Posted April 9.,,351890,1 of 2 people (50%) found this review helpful,True,"You know, this is the best thing ever. I'm very happy I bought this.The acheivements were hard, but very fun. Completed some sidejobs EASYILY due to the modifacations.And overall, i give this pack an 8/10, the 10/10 and 9/10 is because it doesn't add in a heist, and music."
,Posted February 5.,,550,0 of 1 people (0%) found this review helpful,True,"Everything in a zombie apocalypse put in to ONE. 10/10, TLW."
,"Posted October 28, 2014.",,319510,0 of 1 people (0%) found this review helpful,True,Most scariest game since Amnesia: The Dark Descent!
,Posted August 10.,,51100,No ratings yet,False,eh.
,Posted July 26.,,274170,No ratings yet,True,"This game is an astounding breakthrough on modern top-down shooters, even leading on to other games, a custom level workshop for campaigns and single levels, and even figurines. This deserves the 3rd game of the series, Midnight Animal, to be even better than the other 2 games. Hotline Miami 3: Midnight Animal, will probably make a more astounding comeback in the series, even if its not by the real developers."
,"Posted July 16, 2015.",,99900,No ratings yet,True,"This is like a kids game, but is ment to be a enormus MMO. 10/10."
,"Posted March 29, 2015.",,304930,No ratings yet,True,GIV MEH OPCHIN TO REPORT LAST DAATH LICK ACHWUNSEEWUN!!!!!111111!1111!!!1
,"Posted March 14, 2015.",,354140,No ratings yet,True,Best Horror Game 10/10.
