funny,posted,last_edited,item_id,helpful,recommend,review
,Posted January 5.,,353370,1 of 1 people (100%) found this review helpful,True,SUPER COOL!!!!! I use it all the time the typing is okay got to get used to it but its most defienly helpful
1 person found this review funny,"Posted June 6, 2014.",,224260,2 of 3 people (67%) found this review helpful,True,Its scares me
,"Posted December 15, 2013.",,70000,1 of 2 people (50%) found this review helpful,True,THIS GAME IS THE GAME I HAVE BEEN DREAMING OF WHEN IT COMES TO FIRST PERSON SHOOTER GAMES AND IT HAS DINOSAURS I LOVE DINOSAURS!!!!!!!!!!!!!!!!!!!!!!!!!! YOU HAVBE TO BUY THIS BLOODY GAME ITS FREAKING EPIC AND OCCASHIONALLY YOU GET TO BE A T-REX THATS BETTER THAN ANYTHING!!!!!!!!!!!!!!!!!!!!!!!!!!!!!!!!!!!!!!!!!!!!!!!!!!!!!!!!!!!!!!!!!!!!!!!!
,"Posted November 17, 2015.",,109600,1 of 4 people (25%) found this review helpful,True,very awesome makes me smile reminds me of the origonal dungonds and dragons :3
,Posted January 9.,,286100,No ratings yet,True,beautiful but i got stuck XD
