funny,posted,last_edited,item_id,helpful,recommend,review
,"Posted December 4, 2014.",,10680,6 of 6 people (100%) found this review helpful,True,"Jogo muito bom, até bem assustador no inicio, vale cada centavo..."
,"Posted December 4, 2014.",,203160,1 of 1 people (100%) found this review helpful,True,"Muito bom, a campanha por si ja vale o jogo, ma sainda tem o multiplayer que por sinal e muito bom também, o ponto mais forte no jogo acaba sendo o envolvimento do jogador, com muitos momentos em que você deve pressionar uma tecla rapidamente para sobreviver.  Dou 9/10."
,"Posted December 4, 2014.",,4920,3 of 6 people (50%) found this review helpful,False,"Realmente para brasileiros não é uma boa se não estiver em promoção, servidores que tem ping mediano, estão quase sempre cheios, e em alguns servidores ainda podem lhe kikar ou banir por ser novato e não demonstrar habilidade..."
,Posted May 10.,,247730,No ratings yet,False,"Jogo bem incompleto, com poucos recursos e tarefas desanimadoras, poucos servidores, poucos jogadores, sem duvida um disperdiçio de dinheiro, pelo menos para mim."
,"Posted March 21, 2015.",,241540,No ratings yet,True,"Melhor jogo que já adquiri aqui na steam, vale a pena!"
,"Posted February 23, 2014.",,17390,No ratings yet,True,"Jogasso recomendo ! Varios estilos de jogos em um só, sem falar que pra quem gosta de customização e jogos que dispoem de uma grande liberdade esse é o jogo !"
