funny,posted,last_edited,item_id,helpful,recommend,review
,"Posted August 27, 2015.",,322170,1 of 1 people (100%) found this review helpful,True,"Been playing this game for 6+ months now. Love the game, addictive too! Recommended for everyone!"
,Posted June 21.,,451000,3 of 6 people (50%) found this review helpful,True,Haven't even spent an hour and already hooked! Great visuals and simplistic gameplay. Pretty good game.
,Posted June 18.,,239820,No ratings yet,True,Loved the game to bits! Played for two days and got to the end game stuff. Can't wait for an expansion or sequel!
,"Posted September 11, 2015.",,346110,No ratings yet,True,"I love this survival game, I play almost everyday for a least 2 hours. A must have game."
,"Posted July 17, 2015.",,304930,No ratings yet,True,"Great game! Played it lots of times, enjoyed it so far!"
