funny,posted,last_edited,item_id,helpful,recommend,review
,"Posted July 20, 2013.",,219890,0 of 1 people (0%) found this review helpful,True,Thinking mans game 10/10
,"Posted December 24, 2012.",,440,0 of 1 people (0%) found this review helpful,True,Best game this summer :-)
,"Posted May 3, 2012.",,17500,0 of 1 people (0%) found this review helpful,True,game 4 gangstaz
,"Posted January 28, 2015.",,4000,No ratings yet,True,"Fantastic lil game to bypass time, its like lego, you can build all the things."
,"Posted January 28, 2015.",,256410,No ratings yet,True,Fantastic lil game this one.
