funny,posted,last_edited,item_id,helpful,recommend,review
,"Posted September 30, 2015.",,4000,1 of 1 people (100%) found this review helpful,True,Preciso dizer algo?
,"Posted March 30, 2014.",,109400,1 of 2 people (50%) found this review helpful,True,Joguinho legal pra jogar com os amigos :)
,"Posted December 26, 2015.",,346110,2 of 5 people (40%) found this review helpful,False,"tenho os requisitos recomendados e laga pra krl , não recomendo :T"
,"Posted November 19, 2015.",,311210,1 of 4 people (25%) found this review helpful,True,"Jogo louco , sinceramente um dos melhores cods que ja joguei , a galera está falando mal pois está muito 'futurista' , não está tanto , o jogo está ótimo , mais recomendo comprar após a optimização dos servers e do jogo , pois em muitos computadores está rodando a 25 fps , nessa faixa. recomendo"
,"Posted November 30, 2013.",,240,No ratings yet,True,"JOGO MUITO BOM,RECOMENDO"
