funny,posted,last_edited,item_id,helpful,recommend,review
,"Posted February 3, 2015.",,730,0 of 1 people (0%) found this review helpful,True,"A Great follow up to an awesome series. Ez money, Ez lyfe"
1 person found this review funny,"Posted February 3, 2015.",,212160,0 of 2 people (0%) found this review helpful,True,"In my opinion, this is the most indepth and most graphicly intense f2p rpg that ive me. WIth tons of content and a multitude of characters and skill trees to choose from. 9/10"
,"Posted February 3, 2015.",,550,No ratings yet,True,Name of the game.
,"Posted February 3, 2015.",,4000,No ratings yet,True,"Playing this with 30 friends in one server is insanely fun. Would play again, if we had a server :)"
,"Posted February 3, 2015.",,240,No ratings yet,True,Play wc3 mod (y)
,"Posted February 3, 2015.",,440,No ratings yet,True,"The start of my steam collection. Ez money, Ez lyfe"
