funny,posted,last_edited,item_id,helpful,recommend,review
,"Posted December 23, 2014.",,9480,0 of 1 people (0%) found this review helpful,True,Smoked Weed In Front Of A Cop Started Shooting At Me Shot At An Old Man Thru His Walker On The Road And Bolted XD 10/10
,"Posted January 1, 2015.",,440,No ratings yet,True,100000000000000/10 ign my hours on this game broke the system SO I HAD TO UNISTALLL and lost all my unusuals sad story 4 all of us m8
,"Posted December 12, 2014.","Last edited May 2, 2015.",332800,No ratings yet,True,Pros:Alot HarderNew ScreamsNew CharactersIts A PrequalCons:2 SPOOKY 4 MELOVE AND H8
,"Posted November 3, 2014.",,319510,No ratings yet,True,When I saw people play this game and how much credit the game got I thought people were turning into ♥♥♥♥♥s but when i bought the game and completed it I changd and loved it its a genuinely scary game and I recomend to anyone who loves a goood jump scare!
,"Posted August 24, 2014.",,221100,No ratings yet,True,I Just Bought The Game And For AnyOne Who Likes It But Is Not Sure Cause Its in alpha its not that bad at the start ther is a screen resoloution glitch but google that and problem fixed not that many bugs to ruin the fun all round great gamplay love it!
,"Posted September 13, 2013.",,620,No ratings yet,True,Great Game Keeps You In For Hours!!
