funny,posted,last_edited,item_id,helpful,recommend,review
,"Posted November 11, 2014.",,319510,1 of 10 people (10%) found this review helpful,False,"Freddy Got Fingered is a really good game, my favorite bit was when we spent 4 nights at Franco's Pizza Plaza Pie Place. IF you enjoy getting a bit spooked, I don't reccomend this game, Pewdiepie has told me that this is very spook and he pooped his pants and accidently got his dog pregnant. I don't know how, he must have missed step 3. I give it a shameful 9/6, would definetely get fingered again."
2 people found this review funny,"Posted November 23, 2014.",,226560,10 of 32 people (31%) found this review helpful,True,'I liked the zombies' - IGN
4 people found this review funny,"Posted July 19, 2014.",,307990,44 of 120 people (37%) found this review helpful,True,"RECOMMENDED FOR ANYONE WHO LOVES TO BREED THE ♥♥♥♥ OUT OF DRAGONS AND ♥♥♥♥, THIS GAMES GETS ♥♥♥♥ING OFF. HOLY ♥♥♥♥ING ♥♥♥♥ THIS GAME IS LIKE IF THE ROCK HAD SEX WITH AN ACTUAL ROCK. THAT'S HOW ♥♥♥♥ING AMAZING THIS MOTHER♥♥♥♥ING MASTERPIECE IS.9001/10WOUlD HORSE AGAIN"
,"Posted November 13, 2014.",,240,No ratings yet,True,I play this after my dad beats me.4/10
,"Posted November 11, 2014.",,8190,No ratings yet,True,"Just cause you all like it, doesn't make it a just cause.I rate it a shameful 8/10."
,"Posted September 3, 2014.","Last edited September 3, 2014.",48000,No ratings yet,True,"So gewdNever beforeSeen suchGreatnessMy fav bitwas theSpider bitbecauseit was my fav bit2/10 - 'So amazing, really brings light to depression' Kotaku when asked what their opinion is on Zoe Quinn."
