funny,posted,last_edited,item_id,helpful,recommend,review
,"Posted December 24, 2015.",,72850,2 of 2 people (100%) found this review helpful,True,Kinda a must have for any steam library...
,"Posted April 5, 2014.",,242880,1 of 2 people (50%) found this review helpful,True,Yoy can drink tea. 10/10
,"Posted December 6, 2013.",,207170,0 of 1 people (0%) found this review helpful,True,A really cool old school RPG...But scarys the crap out of you at timesstill. 8/10
,"Posted May 1, 2014.",,221640,No ratings yet,True,Everyone wants me dead because of this game....WORTH IT 132/10
,"Posted April 20, 2014.",,204630,No ratings yet,True,Better then gta5 10/10
