funny,posted,last_edited,item_id,helpful,recommend,review
,"Posted August 17, 2014.",,301520,No ratings yet,True,a Great game where you biuld your personal craft and battle ageinst otherssimular to world of tanks9/10
,"Posted June 22, 2014.",,239820,No ratings yet,True,"An awsome bussiness game, wish the platform and story was longer though, I hoped it may get up to a point of having more people and a bigger team, I review this as a 7/10!Note, this is a personal review of the game i have expereinced and other jorney may turn out different."
,"Posted June 20, 2014.",,239030,No ratings yet,True,the game is awsome!
,"Posted December 31, 2013.",,6000,No ratings yet,True,"starwars republic commando, a reviewThis game is and increadle game, a vary uniqe game in the starwars industry as you start out as a republic commando an elite soilder, in this FPS you lead a group of highly traind soilders and  do intese combat missions.Great game, good stor.8.5/10Snazzyredy01/01/2014"
,"Posted December 31, 2013.",,6060,No ratings yet,True,"starwars battlefront 2, a reviewThis game is one of the top ten games as i played as a child and for its days this would be a 9.5/10Snazzyredy01/01/2014"
,"Posted December 31, 2013.",,247730,No ratings yet,True,"Neither, a ReviewThe neither is a great game in as an alpha stage and runs greatly, but be warned other online players will mostly will not be friendly so getting a trusting buddy to go around the streets is a great idea, if anyone wants to play this game i am happy to compony in these dangerous streetsFrom Snazzyredyi give this game (in alpha stage) 7.3 out of ten (meaning it still needs ALOT of work) 01/01/2014"
