funny,posted,last_edited,item_id,helpful,recommend,review
,Posted February 25.,,387860,No ratings yet,True,"Oh ♥♥♥♥♥♥, estoy loco"
,"Posted October 30, 2015.",,401920,No ratings yet,True,EL HYPEEEEEEEEEE
,"Posted January 30, 2015.",,286360,No ratings yet,False,"jugue dos horas de juego, no pude seguir avanzando, el juego no deja nada claro, aparte, trate de seguir luego de varios intentos un gameplay sin lograr resultados... pesimo"
,"Posted January 12, 2015.",,620,No ratings yet,True,"Gran juego, logra mantenerte ocupado por unas cuantas horas con una historia muy novedosa y sin dejar de estar apegado a lo que fue portal 1, 9/10"
,"Posted July 30, 2014.",,304930,No ratings yet,True,"Es un pedazo de cacho de trozo de juego, muy recomendado se pegaran un viciooote!"
