funny,posted,last_edited,item_id,helpful,recommend,review
2 people found this review funny,"Posted November 1, 2015.",,313120,3 of 4 people (75%) found this review helpful,True,10/10 Best turtle hunting simulator I've played yet.
,"Posted September 24, 2015.",,203160,1 of 1 people (100%) found this review helpful,True,"*Clears throat* This is a really good game but forget any hopes and dreams of getting the multiplayer achievements because it's dead. Completely dead. Rest in peace multiplayer, gone and probably forgotten. Still, 10/10 would recommend this game for the single player."
1 person found this review funny,"Posted September 24, 2015.",Last edited April 29.,265630,2 of 3 people (67%) found this review helpful,True,"Still fun and all, but the recent updates are ruining it :/"
,Posted April 14.,,391720,No ratings yet,True,This game is a work of art <3
,"Posted October 21, 2015.",,387860,No ratings yet,True,Found the man in the cage and then killed him.10/10 would play again.
,"Posted October 9, 2015.",,221910,No ratings yet,True,Get out of the broom closet Stanley.
