funny,posted,last_edited,item_id,helpful,recommend,review
,"Posted September 6, 2014.",,236390,No ratings yet,True,this game is fun to play but is very pay to win
,"Posted August 9, 2014.",,47700,No ratings yet,False,This is the game that killed one of the best strategy game series of all time
,"Posted April 25, 2014.","Last edited October 10, 2014.",244850,No ratings yet,True,Space Engineers is a very fun game with little to no bugs and alot of gameplay. i am always finding new cool things to do and they are adding new thing all the time.
,"Posted April 25, 2014.","Last edited November 29, 2014.",233250,No ratings yet,False,"don't buy this game. played it at alpha lots of bugs. i now play it and i crashes for me and my frends all the time!this game would be fun if it worked,  but it does not."
,"Posted February 4, 2014.",,222750,No ratings yet,True,"so many things to do, fun gameplay. if you like RTS games this is the game for you."
,"Posted December 20, 2013.",,219830,No ratings yet,True,"one of the best 2D games i have ever played, i play it every day. it is one of thoughs games you can just pick up and play."
