funny,posted,last_edited,item_id,helpful,recommend,review
,"Posted November 12, 2015.",,389570,1 of 2 people (50%) found this review helpful,True,este juego es la ♥♥♥♥ hostia como agar.io pero en este tienes niveles y habilidades es muy mejor me encanta ojala que un dia lo mejoren mas :D  me llamo slingshot  que lo escribio bye
,Posted May 17.,,304930,No ratings yet,False,♥♥♥♥♥♥ de juego no veo a perdsonas y veo que los zombis golpean al aire y el zombi muere y escucho disparos  y no veo a la genta y me mata alguien desde yo se que donde
,"Posted December 5, 2015.",,218620,No ratings yet,True,mejor juego que egh jugado  recomiendo que lo lo conpren la graficos son una ♥♥♥♥♥♥ lo se pero algo algo no  bueno gente espero que lo conpren bye :3
,"Posted November 22, 2014.",,319510,No ratings yet,True,me gusta este juego por que me gusta vigilar cosas y ademas me interesa mas por la muerte del tipo del telefono ok estabien hoygan me hacen un fabor eh recien estre y vi que five nigths at freddy s y se be  hacia la derecha ok adios
,"Posted September 1, 2014.",,49520,No ratings yet,True,BORDELANDS 2 ES UNA ONDA DE JUEGO NO ESTA E INGLES EL FINAL ES EPICO COMPRENLO POR QUE PUEDO JUGAR CON AMIGOS :D
