funny,posted,last_edited,item_id,helpful,recommend,review
,Posted January 26.,,241540,3 of 4 people (75%) found this review helpful,False,It's a good game. But it has horrible optimization and the developers abandoned it for an 'Enhanced Version.'
,"Posted September 19, 2015.",,221100,0 of 7 people (0%) found this review helpful,True,"If you can get past all the hackers and glitches, this game is a solid Apocalypse survival game."
,Posted February 15.,,305620,No ratings yet,True,I can't feel my hands... or anything.
,Posted January 7.,,4000,No ratings yet,True,"I haven't spent long with the game, It's pretty cool so far."
,Posted January 5.,,730,No ratings yet,True,Help... Me...
,"Posted October 27, 2015.",,38410,No ratings yet,True,Became a porn star 10/10 would do mutant again.
,"Posted September 19, 2015.",,40800,No ratings yet,True,"This game made me rage, that means it did its job."
,"Posted November 14, 2014.","Last edited December 8, 2015.",72850,No ratings yet,True,Found a man at a campfire... with 2 trolls. 10/10 Equality
