funny,posted,last_edited,item_id,helpful,recommend,review
,"Posted July 27, 2015.",,39000,No ratings yet,True,"O jogo é ótimo muito legal e engraçado , para jogar com os amigos é muito mais legal ainda ...muitas missões para se fazer os graficos sao bonitos e e a historia bem interessante."
,"Posted July 17, 2015.",,317360,No ratings yet,True,O jogo mt ♥♥♥♥ vei sem zueiras eu pençando que era em primeira pessoa mais parabens a desivolvedora gráficos maneiros e a armas sao boas Acessem meu canal no youtube : https://www.youtube.com/channel/UC3g1YSmhbJx8jVk3bhKlbyA
,"Posted July 9, 2015.",,291210,No ratings yet,True,Graficos bons jogatina manera e as armas sao muito boas voce fazendo os Loadouts de armar prefiridas voce fica embativelEntre no meu canal para ver gameplay desse jogo e outros demais :  https://www.youtube.com/channel/UC3g1YSmhbJx8jVk3bhKlbyA
,"Posted June 25, 2015.",,342150,No ratings yet,False,esse jogo é muito confuzo é bom joga dota do q isso pqp
,"Posted April 20, 2015.",,304930,No ratings yet,True,quando tiver na casa do tio com um pc e a net melhor que a minha é uma boa opçao para joga
,"Posted January 19, 2015.",,570,No ratings yet,True,Muito bom quando vc chega na parte de proficional vc pode ganhar dinheiro muito bom mais tem que ser um jogador bom
