funny,posted,last_edited,item_id,helpful,recommend,review
,"Posted December 27, 2013.",,400,1 of 1 people (100%) found this review helpful,True,"Oh... where do I begin? It would take too long to write what I'm thinking here, so, it should have been GOTY"
,"Posted May 15, 2013.",,105600,1 of 1 people (100%) found this review helpful,True,"like Minecraft, exepet 5 times better!"
,Posted February 28.,,413410,0 of 1 people (0%) found this review helpful,True,"This game is absolutley awesome. If, like me, you love the Ace Attorney games, you should buy this game. Like, NOW.Also, don't get too attached to a majority of the characters. Most of them die.What's that? An actual review? Pfft... no!"
,"Posted November 26, 2013.",,11610,4 of 19 people (21%) found this review helpful,False,This game DOESN'T WORK!
,"Posted November 25, 2015.",,377160,No ratings yet,True,Play this game already. Enough said.
,"Posted November 6, 2015.",,204360,No ratings yet,True,"If you don't have this game, there is something definetly wrong with you. What are you waiting for? The 'Add to Cart' button is right there!"
