funny,posted,last_edited,item_id,helpful,recommend,review
,"Posted February 4, 2014.",,570,No ratings yet,True,es un buen juego lo recomiendo mucho
,"Posted February 3, 2014.",,17500,No ratings yet,True,es buen juego
,"Posted February 2, 2014.",,224260,No ratings yet,True,es un juego increible es muy realista
,"Posted January 13, 2014.",,233720,No ratings yet,True,es buen juego me gusta su jugabilidad
,"Posted December 26, 2013.","Last edited October 28, 2015.",440,No ratings yet,True,god game :)
