funny,posted,last_edited,item_id,helpful,recommend,review
,Posted August 3.,,301520,4 of 5 people (80%) found this review helpful,False,What happened to the days of making pixel art with coloured blocks :(
3 people found this review funny,Posted September 16.,,275850,4 of 6 people (67%) found this review helpful,False,No man can refund this game :(
,"Posted December 1, 2015.",,207140,No ratings yet,True,i now hate most of my friends who paly this game
,"Posted October 17, 2015.",,252950,No ratings yet,True,try not to cry when you hit the crossbar from kickoff :'(
,"Posted October 5, 2015.",,304930,No ratings yet,True,♥♥♥♥
,"Posted March 27, 2015.",,730,No ratings yet,True,BEST GAME
