funny,posted,last_edited,item_id,helpful,recommend,review
,"Posted February 3, 2014.",,41070,1 of 1 people (100%) found this review helpful,True,Serious Sam on Mental makes Dark Souls look like Snake.
1 person found this review funny,"Posted March 12, 2014.",,47890,2 of 3 people (67%) found this review helpful,True,The only universe where you can mate a Neo-Nazi with a Negro.Costs 400Bucks> for the whole game3/10
,"Posted March 12, 2014.",,213670,2 of 4 people (50%) found this review helpful,True,"Like a 10 hour long South park episode.-Tho I miss some big characters from the show, like Santa, Satan and Saddam. -It could be longer, considering it costs 40€. +Only game i'm buying Dlc' for.+Huge replay valueTENOUTTATEN!"
,"Posted December 13, 2013.",,44350,1 of 2 people (50%) found this review helpful,True,"Fun game I picked up for 10 Euros, long 'campain', lots of cars. Fancy graphics, good mechanics. The only problem is that you're gonna need a pretty good setup to run it to the max. Them shadows ya' know8/10"
,Posted June 10.,,236390,4 of 10 people (40%) found this review helpful,False,Free to play*
,"Posted February 3, 2014.",,245470,1 of 5 people (20%) found this review helpful,True,"Not worth the 23 Euros I spent. Fun game, but it gets really boring really fast. Buy it on a sale if anything. Recommended if you want to be a neo-nazistic dictator."
1 person found this review funny,Posted June 2.,,370240,3 of 10 people (30%) found this review helpful,True,They finally added Kareem Abbdul Jabbar to the game so I really dont give 2 ♥♥♥♥♥ about the rest of the gameIt's ok.
