funny,posted,last_edited,item_id,helpful,recommend,review
,"Posted October 10, 2015.",,10680,1 of 1 people (100%) found this review helpful,True,"The Best, the story in single player is really good. Multiplayer..... just add me and ask me if you want to play multiplayer"
,Posted January 10.,,298240,0 of 1 people (0%) found this review helpful,False,pay to win
,Posted January 3.,,327130,0 of 1 people (0%) found this review helpful,False,Totally not worth it for 10 bucks... Third person view in this dlc mission only
,"Posted October 9, 2015.",,49540,0 of 1 people (0%) found this review helpful,False,"No-one play multiplayer, graphics is so bad, AI broken, mission got problem (because AI sometimes wount move) and many more!"
,Posted March 6.,,227940,0 of 2 people (0%) found this review helpful,True,Its a good game even with unbalance match you still having fun playing it.
,Posted April 30.,,220200,No ratings yet,True,just do it
,"Posted September 5, 2015.",Last edited September 3.,271590,No ratings yet,True,Graphics: AstonishingStory Mode: ImpressiveOnline: Pretty Good9/11
,"Posted September 4, 2015.",,244450,No ratings yet,False,Crash and crash and crash... + loading for multiplayer recource that takes for ever!!!
,"Posted September 3, 2015.",Last edited January 27.,236390,No ratings yet,False,"If you are Asutralian, Please do NOT download and even play this gameWell its a torture for Australian gamers... Because there is no Australian server. > South Asian server will give you ping 999 with pl 4%> US server will give ping 500-999> EU: ping 999> RU: ping 999None of the server works for australia"
