funny,posted,last_edited,item_id,helpful,recommend,review
,Posted March 13.,,386360,0 of 1 people (0%) found this review helpful,True,good 
,Posted May 5.,,32500,1 of 4 people (25%) found this review helpful,True,Would rather eat my ♥♥♥♥
1 person found this review funny,"Posted November 18, 2015.",,4000,No ratings yet,True,Heard it was a good gamenow i am the gamehelpi am at -33.856............
,"Posted July 14, 2015.",,212630,No ratings yet,True,d
,"Posted December 11, 2013.",,730,No ratings yet,True,This game is better then any shooter (apart from Battlefield)
