funny,posted,last_edited,item_id,helpful,recommend,review
,"Posted September 15, 2014.",,72850,0 of 1 people (0%) found this review helpful,True,this game is soo good it got a 94/ 100 metascore but my is 100/ 100
,"Posted June 23, 2015.",,346110,0 of 2 people (0%) found this review helpful,True,i love this game but there only one problem. i got a shity computer
,Posted July 4.,,238960,No ratings yet,True,:D you know what i mean
,"Posted August 16, 2015.",,389570,No ratings yet,False,g*y version of agar.io
,"Posted August 4, 2015.",,730,No ratings yet,True,easiest way to waste your money is to keep playing this game.10/10 would waste money even more
,"Posted July 1, 2015.",,570,No ratings yet,True,this game is so good i can't stop wasting my money.( I lose money and get no profit )10/10
,"Posted September 9, 2014.","Last edited September 9, 2014.",440,No ratings yet,True,recommened for player who like first and third person shooter and player who like playing together 10/10
