funny,posted,last_edited,item_id,helpful,recommend,review
,Posted September 6.,Last edited September 6.,346110,21 of 27 people (78%) found this review helpful,False,"Uninstalled and hid it from my library due to being against the idea of large paid content being released before the game itself is even fixed and ready. The precedent it sets is gross, and has cemented my decision to not purchase an early access title again. Being unable to refund it is a giant bummer."
1 person found this review funny,"Posted September 4, 2015.",,234140,0 of 3 people (0%) found this review helpful,True,YOU'RE A WINNER MAX! A WINNER!
,"Posted August 6, 2014.",,61600,No ratings yet,True,"Peaceful, lovingly made binding puzzle game. Really soothing music."
,"Posted August 6, 2014.",,220780,No ratings yet,True,"Quality platformer for those wanting time-sinky simple puzzles. Deceptively straight forward levels keep getting more expansive and difficult, sometimes requiring quite some time planning and executing."
,"Posted July 22, 2013.",,6310,No ratings yet,True,Still my favourite point and clicky.
