funny,posted,last_edited,item_id,helpful,recommend,review
,"Posted June 5, 2015.",,22380,1 of 2 people (50%) found this review helpful,True,"Fallout: New Vegas is a very fun free roam, RPG Shooter because the area you explore is intresting, the quest are fun and it feels so satisfying to kill someone with any weapon!The only problems are having to config the game to stop the screen flickering and the random crashes that happen often.other than that You should buy the Ultimate edition of this game when its on sale."
,"Posted September 14, 2015.",,38830,1 of 3 people (33%) found this review helpful,False,"play only for the tf2 hat, this game is boring, dull and not fun at all"
,"Posted December 30, 2015.",,7670,No ratings yet,True,"A Really Atmospheric FPS with some Horror thrown in to add to the dark, disguisting underwater city called Rapture.this is a shooter you should definitely get if your into dark FPS or just FPS in general"
,"Posted August 24, 2015.",,500,No ratings yet,True,"This game still holds up to this day and is also fun to play a bit even if you have the 2nd game, so you should get this game if you want a fun zombie game, even if you own the 2nd one, buy this game for your friends and play together, this is a experince you don't want to miss"
,"Posted August 6, 2015.",,385710,No ratings yet,True,This game is Beutiful and Amazing!
,"Posted May 16, 2015.",,298180,No ratings yet,True,if you like 2D Platformers and RPG'S you will love this game                                                                                                               Visuals are Amazing!Game play is fun as helland also a deep story linethis game is a masterpiece 9 out of 10
,"Posted December 17, 2014.",,550,No ratings yet,True,"This game is for anyone who like multiplayer shooters, Zombie games or if you are intrested in this game then buy this game NOW!! In my opinion this is the best PC Game Ever Game!!! just go buy it, install it and play it imediatley. if you haven't bought this game yet (which i hope you already have) then BUY IT NOW!!!!!!!!!!!!!"
