funny,posted,last_edited,item_id,helpful,recommend,review
15 people found this review funny,"Posted June 21, 2015.","Last edited June 22, 2015.",222880,13 of 15 people (87%) found this review helpful,True,Pros+Allahu AkbarCons-Allahu Akbar
,Posted June 25.,,209670,4 of 9 people (44%) found this review helpful,False,"♥♥♥♥ing developer abandoned it to make some other bloody game. The game itself is fun, has alot of replayability value, lots of explosions and gore. If you don't mind playing a abandoned game you can buy this (it also has alot of mods).(i got like 300+ hours on a pirated B27 version.)"
,"Posted June 7, 2015.",,271590,0 of 1 people (0%) found this review helpful,True,Got Franklin and Trevor spooked. They noclipped through the plane and fell down later.11/10 3spook5me
,"Posted April 4, 2014.",,218620,0 of 2 people (0%) found this review helpful,True,Cloaker jumped out of a toilet cubicle and knocked me down. 10/10
,"Posted June 13, 2015.",Last edited September 5.,730,No ratings yet,False,"died after september 2015, we get these ♥♥♥♥♥♥ animations with ♥♥♥♥ing wires that causes lag, an overpowered revolver, and a ♥♥♥♥♥♥♥t rank system update:win 8 times = no rank uplose 1 match = derankthey got time to add in these gloves and cases but no time to optimize the game, with every increasing update the game runs slowerrest in peace csgo 2012-2015, ♥♥♥♥ you valve"
