funny,posted,last_edited,item_id,helpful,recommend,review
,"Posted June 23, 2014.",,247000,1 of 3 people (33%) found this review helpful,True,Fantastic Game true to the board game !!
,Posted April 19.,,330840,0 of 1 people (0%) found this review helpful,True,"Awesome Series! Closest thing to GoT fix off season, story and characters are great and ties in well with the show. only problem is i found it too short... just like the Tv series. highly recommend a play through though!"
,"Posted June 23, 2014.",,4580,0 of 1 people (0%) found this review helpful,True,"Best DoW Game Ever, Worthy of a spot in any collection!!"
,"Posted June 23, 2014.",,223830,No ratings yet,True,"Fantastic Game based on xcom, just the right amount of awesome in every way. !!"
,"Posted June 23, 2014.",,245620,No ratings yet,True,"'Amazing Game, buy it or i will have your family fed to the Llamas' - El Presidente."
,"Posted June 23, 2014.",,34330,No ratings yet,True,Possibly the best EVER Total war game !!
