funny,posted,last_edited,item_id,helpful,recommend,review
,"Posted June 14, 2015.",,730,0 of 1 people (0%) found this review helpful,True,"I mean pretty good game, great community. Dont get butthurt have fun."
,"Posted November 10, 2012.","Last edited June 14, 2015.",630,0 of 1 people (0%) found this review helpful,True,Game is free and heaps fun with friends.
,"Posted May 20, 2012.","Last edited June 14, 2015.",41500,0 of 1 people (0%) found this review helpful,True,"Great fun game, I found it more engaging than the other one for some reason."
2 people found this review funny,"Posted July 9, 2015.",,359320,2 of 6 people (33%) found this review helpful,True,"Some guy tried to convince me to leave my life of bountry hunting and smuggling, offered me a new job and some credits to start a new life. Killed him and took his cargo an sold it on the black market and bought a new ship to continue smuggling and bounty hunting. 10/10 best game OCE."
,"Posted June 14, 2015.",,56400,2 of 6 people (33%) found this review helpful,False,"Only reason you would even think about getting this is for last stand, which no one plays anymore. If you like skirmish battles and campaign, get Soul storm, its far better."
,"Posted June 14, 2015.",Last edited August 18.,19900,0 of 2 people (0%) found this review helpful,True,"This game is like a potato, its pretty good, but not amazing. I like it."
,"Posted June 14, 2015.",Last edited August 18.,211820,No ratings yet,True,"I raided villages for their chairs and fridges to sell so I could buy a hoverbike, best game OCE 8/8 for a mate"
