funny,posted,last_edited,item_id,helpful,recommend,review
,"Posted December 21, 2014.",,730,0 of 1 people (0%) found this review helpful,True,Very Competitive and Fun To Play
,"Posted March 30, 2013.",,440,0 of 1 people (0%) found this review helpful,True,This game is awsome !!!!!
,Posted March 23.,,202970,No ratings yet,True,Last Good COD Game.
,"Posted May 10, 2015.",,248570,No ratings yet,True,"From running, punching, kicking, jumping, sliding, freerunning, jousting  you canjsut about anything in this game :D :D"
,"Posted December 27, 2014.",Last edited January 3.,300,No ratings yet,False,"It might be realistic, but the community is utter ♥♥♥♥. You got old men who think they know all about the game. And ♥♥♥♥♥♥ admins telling you not to quickswitch, for no reason. While, the gameplay is absolutely amazing, the community just ruins the game's reputation. Do Not Get This Game (Unless you want to belong in a community where WW2 ♥♥♥♥ gather)."
