funny,posted,last_edited,item_id,helpful,recommend,review
,"Posted July 10, 2015.",,287980,1 of 1 people (100%) found this review helpful,True,I recommend this game so much i could play this hours non-stop this is game that fun.I thing i want in mini metro is sound  it makes mini metro more likely to play.I rate this 10/10Good Price! :)
,"Posted October 15, 2015.",Last edited August 19.,24010,1 of 3 people (33%) found this review helpful,False,This game is Money Laundering Scheme it's so horrible.Come on Make all dlc FREE!
,"Posted January 15, 2014.",,267600,2 of 25 people (8%) found this review helpful,True,Its awesome!!!!!
,"Posted September 27, 2015.",,41800,No ratings yet,True,"It's okay, but i still recommed getting this game, the battles are hard which makes it more fun to play, lots of mission, tons of ship types and many more things to this game.My rating7.5/10 Meh"
,"Posted September 27, 2015.",,230290,No ratings yet,True,"It's one the Best PHYSICS games out there.You can crash Galaxys together.Take a revenge on the moon and sun!Theres a lot of things i love about this, the collsions are so BEAUTIFUL.I only got this yesterday i'm addicted to it.This is my Favourite Physics game.My rating.199/199"
