funny,posted,last_edited,item_id,helpful,recommend,review
,Posted August 6.,,357670,4 of 4 people (100%) found this review helpful,True,"Almost comical, but very serious business to do."
,Posted August 6.,,450540,2 of 2 people (100%) found this review helpful,True,The best VR game out there! Great dev that listens to us! 11/10!
,Posted August 6.,,436820,1 of 1 people (100%) found this review helpful,True,Best free Vr game out there!
,Posted August 6.,,446750,1 of 1 people (100%) found this review helpful,True,Great view into the portal world in VR
,Posted August 6.,,270130,1 of 1 people (100%) found this review helpful,True,A great game for VR. Can't wait for the next episode!
,Posted August 6.,,412740,1 of 1 people (100%) found this review helpful,True,One of the best VR games out there! 10/10
,"Posted December 4, 2014.",,289650,4 of 12 people (33%) found this review helpful,True,"Awesome, but still a few glitches"
