funny,posted,last_edited,item_id,helpful,recommend,review
1 person found this review funny,"Posted October 5, 2014.",,1250,12 of 12 people (100%) found this review helpful,True,ในใจตลอดกาลครับ ใครเกิดยุคนี้แล้วไม่ได้เล่นKilling Floor ถือว่าพลาดมาก555555
,"Posted October 16, 2014.",,24240,5 of 6 people (83%) found this review helpful,True,หนุกมากครับ ซื้อไปเถอะ แต่ผมได้มาฟรี
,"Posted October 20, 2014.",,218620,No ratings yet,True,GOOD GAME
,"Posted October 16, 2014.",,236390,No ratings yet,True,ใครไม่ลองเล่น ถือว่า พลาดนะแจ๊ะ
,"Posted May 16, 2014.",,219640,No ratings yet,True,แนะนำให้ซื้อนะครับ สนุกมากลองเล่นดูแล้้ว แปปเดียวก็จับทางเล่นได้สบาย แต่เสียดายผู้เล่นบางคนชอบบ่นมากเกินไป ^^
