funny,posted,last_edited,item_id,helpful,recommend,review
,"Posted November 8, 2014.",,219150,1 of 1 people (100%) found this review helpful,True,killing random russian mobsters saving a hookerkill a few police menunlock weapons and maskssounds like a good game?it is10/10
1 person found this review funny,"Posted October 6, 2015.",,218620,No ratings yet,True,It has Jacket. the sociopath. too bad I have a potato computer.
,"Posted October 3, 2015.",,207140,No ratings yet,True,Perfect for people with asthma.
,"Posted April 18, 2015.",,440,No ratings yet,True,"its good, i need more hats though"
,"Posted April 5, 2015.",,22380,No ratings yet,True,I love the mods thats all ...
