funny,posted,last_edited,item_id,helpful,recommend,review
,"Posted August 15, 2015.",,22380,1 of 1 people (100%) found this review helpful,True,if you dislike this game when you go to sleep at night ill be under your bed and when your asleep i will eat your doritos and drink your mounten dew and then turkey slap you
,"Posted June 6, 2015.",,223470,1 of 1 people (100%) found this review helpful,True,in what game can kick a grenade at people and also kick a cows head and make them vomit blood and ♥♥♥♥ into peoples mouth? ill tell you postal 2 duh but its a really fun game to play the dlc is ok not as good as the normal mode but if youre bored and want some fun buy this game and if you want to have even more fun get mods a use cheats to get all weapons my overall score is 10/10 its will give you a smile when you progress and the achevements are just plain funny
,"Posted July 11, 2014.","Last edited May 31, 2015.",304930,0 of 1 people (0%) found this review helpful,True,Unturned is a great zombie survival but its only in early access so dont complain if theres bugs or glitches theres even a bug report button. so my overall score in 100/100
,"Posted August 15, 2015.",,287390,No ratings yet,True,i got to shoot nazis in the face a shotgun 10/10
,"Posted August 15, 2015.",,1250,No ratings yet,True,good game i prefer this over left 4 dead haters gon hate
,"Posted June 12, 2015.","Last edited November 5, 2015.",730,No ratings yet,True,its alright
,"Posted June 23, 2014.",,105600,No ratings yet,True,Terraria is a great game its better than minecraft in some ways like more weapons armor blocks etc its also great to play with friends and its a cheap game to play unlike some other bulding games i give Terraria a 80/100
,"Posted January 6, 2014.","Last edited May 31, 2015.",252490,No ratings yet,True,i have done so many bad things i have no ragrets
