funny,posted,last_edited,item_id,helpful,recommend,review
,"Posted June 17, 2014.",,570,0 of 1 people (0%) found this review helpful,True,"De los mejores MOBA Free2Play que puede haber, aunque quisiera las voces en español. No digo que estén mal las de inglés, pero recuerdo cuando en DOTA habían esas voces coquetas xD. Recomendado si sabes jugar MOBA e igual si tanto no sabes aunque costará cierto tiempo aprender como funciona cada héroe."
,"Posted November 27, 2013.",,202170,0 of 1 people (0%) found this review helpful,True,"Muy bueno, recomendado para todos. Excelente gameplay.Good  4.5/5, nice gameplay"
,"Posted December 21, 2013.",,8980,No ratings yet,True,"Buen juego, muchas horas de entretenimiento y se disfruta mejor con las expansiones, armas totalmente diferentes para cada jugador!"
,"Posted December 21, 2013.",,730,No ratings yet,True,"Nice game, nice gameplay, and nice servers"
,"Posted December 3, 2013.",,50130,No ratings yet,True,"Very good game :D, nice history, gameplay and a good end.Muy buen juego, buena historia, jugabilidad y un buen final."
