funny,posted,last_edited,item_id,helpful,recommend,review
7 people found this review funny,"Posted June 26, 2014.",,218620,129 of 160 people (81%) found this review helpful,True,"Eu desde pequeno que o meu sonho era assaltar um banco , graças a este jogo , tive essa oportunidade de assaltar não um banco , mas sim  vários bancos . Recomendo profundamente a compra deste jogo porque vale mesmo a pena assaltar uns bancos de vez em quando para nós conseguirmos ' sobreviver ' em Portugal ."
1 person found this review funny,"Posted July 3, 2014.","Last edited July 3, 2014.",113400,8 of 12 people (67%) found this review helpful,True,"Este jogo é engraçado especialmente com amigos , recomendo bastante este jogo porque gosto do facto de pudermos personalizarmos as nossas roupas , armas , carros enfim tudo ... Porque não experimentar um jogo que é grátis , na minha opinião um dos melhores ' Free To Play' na steam na minha opinião.Avaliação - 7/10 Razão : Demora bastante a entrar Estás à espera do que para começares a jogar e divertires-te?"
1 person found this review funny,"Posted September 28, 2013.","Last edited November 29, 2013.",730,1 of 3 people (33%) found this review helpful,True,"O cs:go é um jogo que toda a gente gosta de jogar especialmente com amigos , porque tem mais diversão do que jogar individual . Aconcelho vivamente a comprar este jogo , pois eu acho que vale a pena o dinheiro por o mesmo."
,"Posted September 28, 2013.",,440,1 of 3 people (33%) found this review helpful,True,Bom jogo de F2P
,"Posted August 31, 2015.",,356070,0 of 2 people (0%) found this review helpful,True,I really like this game.
