funny,posted,last_edited,item_id,helpful,recommend,review
,"Posted December 15, 2013.",,35420,18 of 25 people (72%) found this review helpful,True,Very fun time killer! This game is not as fun as other objective/survival based games but it gets ☆ ☆ ☆ / ☆ ☆ ☆ ☆ ☆ stars from me :)
2 people found this review funny,Posted August 30.,,275850,9 of 11 people (82%) found this review helpful,False,"Launched No Mans Sky: 'Oh my god I'm so excited! I've been waiting for ages' *game crashes*'Oh might of just been my pc' *Updates graphics card drivers (gtx 760)**Plays game* 'WOW! this is so good I'm so happy with this!'............12.5 hrs of NMS later...'♥♥♥♥ this sack of un-optimised ♥♥♥♥, this is worse than getting catfished'18/18 quintillion would waste 60USD again."
,"Posted June 21, 2014.",,221100,1 of 1 people (100%) found this review helpful,True,Awesome game...SOMEONE FIX THE F***ING LADDERS!!!!!!!!!!!!!!!8.5/10
,"Posted October 25, 2015.",,353690,0 of 6 people (0%) found this review helpful,True,Spawns inTeam mate walks up to meSound glitchK.I.A10/10 would 2 minute respawn again.
,"Posted February 15, 2014.",,238430,No ratings yet,True,This game is very fun however the melee weps should be stronger against zombies :bash:
,"Posted February 7, 2014.",,208090,No ratings yet,True,Amazing game
,"Posted January 10, 2014.",,24240,No ratings yet,True,This Game is just amazing if you don't have a beef enough of a pc to get the 2nd one get this one it is just as good!
,"Posted November 11, 2013.",,224260,No ratings yet,True,"Horror,Survival it is an amazing game! Although quite challanging it has alot of game time."
