funny,posted,last_edited,item_id,helpful,recommend,review
,"Posted September 23, 2014.",,105600,1 of 2 people (50%) found this review helpful,True,เพื่อนผมให้มาเปนของขวัยนะก็สนุกดี เอาชีวิตรอดนะ
1 person found this review funny,"Posted July 18, 2014.",,203160,1 of 2 people (50%) found this review helpful,True,เป็นเกมที่เล่นแล้วเพลินดีครับ กราฟิก เนื้อเรื่องสุดยอดมากเบย ให้ 9.8/10 คะแนนครับรีบสืบเลยในช่วงลดราคาครับมันมากขอบอก
,"Posted December 4, 2014.",,268050,10 of 21 people (48%) found this review helpful,True,ทำได้ดีสำหรับผุ้ให้กำเนิด Resident Evil สนุกมากแต่เล่นแล้วแลค สยองดีลองเล่นูนะครับ
,"Posted June 28, 2015.",,282900,0 of 1 people (0%) found this review helpful,True,เป็นเกมที่ผมเคยดูในการ์ตูนมาก่อนนะ บอกให้เลยว่ามาดูนมและความน่ารักเฉยๆ
1 person found this review funny,"Posted July 27, 2014.",,265210,3 of 8 people (38%) found this review helpful,True,บอกหน่อย ทำ coop ยังไง
