funny,posted,last_edited,item_id,helpful,recommend,review
1 person found this review funny,Posted July 21.,,312720,3 of 4 people (75%) found this review helpful,True,"'You know, I have one simple request. And that is to have chess with frickin' laser beams attached! Now evidently my cycloptic colleague informs me that that cannot be done.'"
,Posted July 26.,,440,1 of 1 people (100%) found this review helpful,True,"It's a good game, but the game is experiencing some weird changes. I believe that it's going in a weird direction right now but it was really good."
,Posted February 26.,,427520,1 of 1 people (100%) found this review helpful,True,played it before steam and it is a fun time black hole
,Posted August 18.,,233450,0 of 2 people (0%) found this review helpful,True,I'll just play a bit of prison architect*Many Many hours later*Send help
,"Posted November 14, 2014.",,97330,1 of 6 people (17%) found this review helpful,True,yes
,"Posted December 30, 2015.",,4760,No ratings yet,True,"a game that gives you the ability to battle a sensible army with your army, filled to the brim with elephants and nothing else."
,"Posted December 25, 2015.",,220200,No ratings yet,True,is good
,"Posted June 16, 2015.",,247020,No ratings yet,True,an amazing game a tiny bit grindy but really frantic and fun
