funny,posted,last_edited,item_id,helpful,recommend,review
,"Posted August 17, 2015.",,730,2 of 2 people (100%) found this review helpful,True,"This game is really enjoyable to play with friends especially in Casual or death-match mode.this game, made me laugh  almost break my mouse whilst playing competitive but it was good fun"
,"Posted January 24, 2014.",,440,1 of 2 people (50%) found this review helpful,True,yay
,"Posted August 21, 2015.",,63380,No ratings yet,True,"Awesome game, played it a little, but so far it is awesome"
,"Posted August 21, 2015.",,252490,No ratings yet,True,"Was awesome when it first came out, it has gotten even better with awesome graphics, game play and everything about it"
1 person found this review funny,"Posted August 19, 2015.",,304930,No ratings yet,True,"Good game, the community can be worse then dayz some times but normally good people <3"
