funny,posted,last_edited,item_id,helpful,recommend,review
,Posted April 20.,,311210,0 of 1 people (0%) found this review helpful,True,*buys game**finds match**everyone is prestige a million*10/10 would get a kdr of -69 again
,"Posted August 29, 2015.",,351800,0 of 1 people (0%) found this review helpful,True,"This game is amazing, left me very confused for hours after. Would highly recommend to indie game enthusiasts and bronies."
,Posted June 9.,,4000,No ratings yet,True,At the time of writing I have 57 hours in this game. 48 of those hours were spent downloading addons8/8 would download 8gb of addons on ADSL internet again
,Posted June 9.,,730,No ratings yet,True,the skin insanity has taken over10/10 would rush b with noob cykas again
,"Posted July 16, 2015.",,369580,No ratings yet,True,"If you can't afford GTA V from Rockstar, this is the perfect game for you. It runs at 1080p 60fps on even the most peasant computers."
