funny,posted,last_edited,item_id,helpful,recommend,review
,Posted August 12.,,227940,1 of 1 people (100%) found this review helpful,False,Steal money and ban you for nothing 0/10
1 person found this review funny,Posted May 6.,,323370,1 of 2 people (50%) found this review helpful,True,Nothing beats lolis in swinsuits.
,Posted August 26.,,257030,1 of 3 people (33%) found this review helpful,True,Is good9/10
,"Posted June 15, 2015.",,212070,1 of 3 people (33%) found this review helpful,True,It's off the chain bruh
,"Posted April 30, 2014.",,570,0 of 1 people (0%) found this review helpful,True,....
,"Posted November 15, 2014.",,230410,No ratings yet,True,mfw this game is awesome
