funny,posted,last_edited,item_id,helpful,recommend,review
,Posted August 24.,,275850,3 of 6 people (50%) found this review helpful,False,"Game is not as what the devs advertised it, this is merely 10% of what was promised"
8 people found this review funny,"Posted January 23, 2015.",,304240,5 of 11 people (45%) found this review helpful,True,"They changed it :(Wanted to see the dog jumpscare at front door, but NO... the dog jumps in now and killed meh :("
,"Posted February 1, 2014.",,208090,0 of 1 people (0%) found this review helpful,False,"Game is currently 'plagued' with bugs, *cant find any games*friends list doesnt work*steam intergation, joining friends games doesnt work*Server location keeps changing to other servers.*kept getting error 300..its currently a pain in the as to play,"
1 person found this review funny,Posted April 18.,,435880,0 of 3 people (0%) found this review helpful,True,"Good DLC for the price , unless your a poor ♥♥♥ that gets dissappointed for $5 content,"
,Posted May 18.,,377160,0 of 4 people (0%) found this review helpful,True,"Hands down one of the best game of 2015, lots of negative reviews here that doesnt make sense, most of them are stuck in the past kind of ♥♥♥♥♥♥♥♥s for morrowind and Fallout 3."
,Posted March 13.,Last edited April 12.,365590,No ratings yet,False,"Game is a hot mess of disaster, April 12 Update was a promise of fix and new content, but its just a piece of sh*t update, made everything have high requirements and everything difficult, even the free DLC was impossible to make, even with 4 players above the required armor gear. game is garbage after april 12th"
