funny,posted,last_edited,item_id,helpful,recommend,review
,"Posted April 7, 2015.",,620,No ratings yet,True,Almost no reference to the ♥♥♥♥en cake!10/10                    /10
,"Posted March 26, 2015.",,570,No ratings yet,True,"Dota is a good ga- *Sorry, I dont know what i was thinking*This should be in Russian.Это хорошая игра, но, черт побери, есть так много русских ..."
,"Posted March 21, 2014.",,70,No ratings yet,True,HL1 = HugeThis game is about 6x larger than COD or Assassins creed graphics are a tiny bit dated but apart from that its brilliant9/10
,"Posted March 21, 2014.",,55230,No ratings yet,True,Really...REALLY...REALLY! Fu*ked up... '-'8.5/10
,"Posted March 7, 2014.",,50300,No ratings yet,True,"This Game Made Me Cry... BEST GAME EVER!11/10But really, its so f**king sad..."
,"Posted January 7, 2014.",,244810,No ratings yet,True,The most British game you will ever play... 10/10
