funny,posted,last_edited,item_id,helpful,recommend,review
1 person found this review funny,"Posted March 27, 2014.",,730,2 of 2 people (100%) found this review helpful,True,I think that more people should play this game i find it amazing and a very fun game. Thank you :)
,"Posted July 13, 2014.",,243870,1 of 1 people (100%) found this review helpful,True,How am i suppost to get the dlcs for free i dont know :/
,"Posted June 21, 2014.",,218620,1 of 1 people (100%) found this review helpful,True,Best game ever played in my life :D
,"Posted May 20, 2014.",,242720,1 of 3 people (33%) found this review helpful,True,♥♥♥♥ GunZ it is ♥♥♥♥ it sucks balls go play better games >:[
,"Posted April 4, 2015.",,203140,No ratings yet,True,"When i started playing this game i found that the grafics were amazing compared to any other game i have ever played, the weponds they have made for the game i think suit it perfectly and you will love the story line if you enjoy long and fun games, i will suggest you should get this game and have fun playing it, trust me you will have fun playing it and enjoying what will happen next :)"
