funny,posted,last_edited,item_id,helpful,recommend,review
1 person found this review funny,"Posted March 17, 2014.",,247730,27 of 50 people (54%) found this review helpful,True,Package Run Simulator 2014
,"Posted December 22, 2013.",,265210,1 of 1 people (100%) found this review helpful,True,A amazing game. A most have for Christmas gamers and gamers who like a bit of a challange and humour. This will keep you entertained for hours.
,"Posted April 4, 2014.","Last edited April 11, 2014.",208090,1 of 2 people (50%) found this review helpful,False,LOLOLOLOLOL.This game is shutting down guys. They closed the Australian Server so now I can't play without lag. Spent real money on it just to be let down....
,"Posted July 11, 2014.",,221100,No ratings yet,True,Masturbated and ♥♥♥♥ed my pants whilst looking at a female zombie.10/10
,"Posted July 5, 2014.",,730,No ratings yet,True,Killed a chicken with a $50 AWP. 50/10
,"Posted January 7, 2014.",,219680,No ratings yet,True,Had a little bit of fun. Certainly relaxes the soul. I got it for sale for $2 so I would say money well spent.
