funny,posted,last_edited,item_id,helpful,recommend,review
,"Posted May 8, 2015.",,356670,0 of 1 people (0%) found this review helpful,True,I'm so startled.9/10 needs more ghosts
,"Posted December 24, 2013.",,42910,0 of 1 people (0%) found this review helpful,True,"Herba flerpa, derp derp heby glerb shrubbery, flerp derp huffa gurb!"
,"Posted January 5, 2014.",,221100,No ratings yet,True,"Beat some guy with a shovel, handcuffed him, bandaged him so he wouldnt bleed out and gave him the book 'The Raven' to read as he roamed the countryside.  10/10 would beat again."
,"Posted November 20, 2013.",,248820,No ratings yet,True,You like roguelikes? You like challenges? You like being killed by a giant ♥♥♥♥ing worm made of fire? Buy this game.
,"Posted June 15, 2012.",,440,No ratings yet,True,"You play it, you play it and you like it. You have no choice in the matter, your concerns mean nothing. All you have to do, is play this game."
