funny,posted,last_edited,item_id,helpful,recommend,review
,"Posted March 26, 2015.",,244850,1 of 2 people (50%) found this review helpful,True,10/10 would die by landing gear again!
,"Posted July 24, 2015.",,105600,No ratings yet,True,One of the best game's on steam i don't see the comparisons to minecraft thou because minecraft and terraria are extremely different. Terraria is a 2D dungeon crawler light rpg game it is worth the price tag.
,"Posted June 22, 2015.",,232090,No ratings yet,True,This game is great with friends enjoying alot of my time with it the only problem is that on biotics lab i can get stuck on a plant but other then then a great game.
,"Posted May 24, 2014.",,221100,No ratings yet,True,DAYZ is a great game with friends but be warned you may lose you save you have be warned.
,"Posted April 23, 2014.",,42910,No ratings yet,True,Awesome must get great silly multi player.
