funny,posted,last_edited,item_id,helpful,recommend,review
36 people found this review funny,Posted March 31.,,446380,37 of 53 people (70%) found this review helpful,True,10 out of  10 scared the ♥♥♥♥ out of me   me me jump so badly i threw my head set  on the ground in terror  by accident
1 person found this review funny,"Posted February 7, 2015.",,281370,4 of 5 people (80%) found this review helpful,False,no i dont recommend this  to ♥♥♥♥en hard  and the owner doesnt help you very well
,"Posted September 16, 2015.",,319630,2 of 3 people (67%) found this review helpful,True,a really good game but for fux sake   the developer's need  to hurry up with episode 5 its been nearly a year
3 people found this review funny,"Posted September 1, 2015.","Last edited September 1, 2015.",339230,8 of 17 people (47%) found this review helpful,False,WORST  ♥♥♥♥EN GAME IN THE WORLD I PAID $20.00 FOR IT   AND IT REFUSES  TO WORK FOR ME  BIGGEST WASTE OF MONEY  IVE EVER DONE     REFUSED REFUND  SO ♥♥♥♥ YOU STEAM
1 person found this review funny,"Posted February 25, 2015.",,287290,5 of 11 people (45%) found this review helpful,False,this is a message to the owner  :   fix your ♥♥♥♥en game now  it lags every 3 seconds   you go walk freeze walk freeze  and thats how it goes  you need alot of paitants to be able to play this game if you dont  .  DONT BOTHER BUYING IT  its not worth the hassle
,"Posted December 4, 2014.",,207140,5 of 12 people (42%) found this review helpful,False,worst game ever made who ever made this game was on drugs  it says press z i press it and it takes ages to work then i just die over and over again  its a stupid game not even worth the money wish i could get my money back on it
,Posted April 30.,,730,No ratings yet,False,got banned for trolling hackers really ??? PULL YOUR FUUUUUCKEN HEADS IN CUUUUNTS
