funny,posted,last_edited,item_id,helpful,recommend,review
,"Posted September 8, 2015.",,208090,No ratings yet,False,"I played this a year ago and it was dead then, apparently its still dead"
,"Posted August 25, 2015.",,70100,No ratings yet,True,It was a nice experience but it takes a while to learn.
,"Posted August 9, 2015.",,334230,No ratings yet,True,Open steamlaunch town of salemlog infind random gameTheres two guys named Jesus and GodGod votes to lynch Jesus and says 'only you can save this damned town'Jesus diesJesus comes back to life from retributionist playertown wins10/10
,"Posted June 20, 2015.",,42120,No ratings yet,False,dont even bother. its dead
,"Posted June 1, 2015.",,102500,No ratings yet,True,One of the best underrated RPG'S of the last generation
