funny,posted,last_edited,item_id,helpful,recommend,review
,"Posted June 25, 2014.",,232430,6 of 9 people (67%) found this review helpful,False,It was OK but only took less then an hour. I don't recommend it just because of that.
1 person found this review funny,"Posted November 14, 2015.",,371420,2 of 4 people (50%) found this review helpful,True,A really intense racer. The mario kart of PC.  Graphics are top notch. Controls are as smooth as butter. This rollercoaster of a story will have you in tears by the end. The music puts Hans Zimmer to shame.
,"Posted July 4, 2014.",,34900,1 of 2 people (50%) found this review helpful,True,A masterpiece
1 person found this review funny,"Posted July 13, 2014.",,220,1 of 35 people (3%) found this review helpful,False,It's boring. It's overrated. It's dull.
,"Posted December 26, 2014.",,200210,No ratings yet,False,Bad game. You can trust me. My play time is high
