funny,posted,last_edited,item_id,helpful,recommend,review
,"Posted December 20, 2013.",,209160,1 of 2 people (50%) found this review helpful,False,"I have played them all, this one is OK not greatBiggest isssue other game itself are the HACKS You need to get rid of them or at least try. They are seriously erroding you franchise at least on PC, I wonder if you care? I know from the people whoI play HC with the same hacks play all the time and while everyoner reports they remain. I have heard that some players have even taken legal steps under Australian consumer law ie assessing the game as not 'as advertised '. Wake up before you don't have a core fan base on PC IF you care???"
,Posted April 13.,,374320,1 of 3 people (33%) found this review helpful,True,Can't wait for Perepare Your ♥♥♥♥ Edition. 7/5 IGN
,"Posted May 26, 2015.",,8930,0 of 1 people (0%) found this review helpful,True,I went a little mad/crazy after the (Just one more turn)......SEND PIZZA
,"Posted April 24, 2015.",,236390,0 of 1 people (0%) found this review helpful,True,"It's a game were kill or be killed is not a option.Things to look out for Rammers, Russian planes/ tanks they will fak you up a creek with no paddle.American/ 50cals of freedomJapanese/ instant fireball, never turn against germany/ powerful 20/30mm/88mm cannonsBrits/ spitfire onlyUSSR / use anything its probs OP"
,Posted February 24.,,359550,1 of 4 people (25%) found this review helpful,True,This game is a home invader sim so any American republican gun loving person will love this game.
