funny,posted,last_edited,item_id,helpful,recommend,review
,"Posted December 18, 2015.","Last edited December 22, 2015.",218620,1 of 8 people (13%) found this review helpful,True,love this game and if you dont have this game yet then what are you waiting for
,Posted January 22.,,293260,No ratings yet,True,this game is so addictive if you like this game play hand of fate
,Posted January 15.,,422400,No ratings yet,True,movie was good and so was this
,"Posted December 13, 2011.",,105600,No ratings yet,True,very good
,"Posted December 13, 2011.",,1250,No ratings yet,True,yes get it now
