funny,posted,last_edited,item_id,helpful,recommend,review
1 person found this review funny,Posted August 13.,,275850,6 of 7 people (86%) found this review helpful,False,"The game is built around the 'procedural universe' gimmick, which gets old very quickly. The gameplay is built around the gimmick, rather than the gimmick around the gameplay."
,Posted August 28.,,250600,0 of 2 people (0%) found this review helpful,True,lol
,Posted August 27.,,355150,No ratings yet,False,Game is based on a gimmick. Its crap.
,Posted August 24.,,427520,No ratings yet,True,One of the best.
,Posted August 21.,,230410,No ratings yet,True,Just started out and I love it.
