funny,posted,last_edited,item_id,helpful,recommend,review
,"Posted July 20, 2012.",,44320,0 of 1 people (0%) found this review helpful,True,Good fun
,"Posted May 8, 2014.",,211050,2 of 6 people (33%) found this review helpful,True,Sweet chess game
,"Posted April 11, 2015.",,304910,0 of 2 people (0%) found this review helpful,True,Top fun online and offline.
,"Posted March 20, 2015.",,268220,No ratings yet,True,Not a bad shooter + love the soundtrack to this game
1 person found this review funny,"Posted March 8, 2015.",,200710,No ratings yet,True,"Brilliant Diablo clone, with some RPG elements"
,"Posted September 22, 2014.",,102600,No ratings yet,True,"Recommended, a nice twist on the tower defence genre"
,"Posted June 30, 2014.",,57680,No ratings yet,True,"Not a bad RPG at all, not the biggest fans of 3rd person games but this one isn't too bad"
,"Posted September 5, 2013.","Last edited June 30, 2014.",226980,No ratings yet,True,The 2nd best pinball sim on pc without a doubt !
,"Posted June 20, 2013.",,204450,No ratings yet,True,"A great western shooter, dueling is great fun"
