funny,posted,last_edited,item_id,helpful,recommend,review
,"Posted December 6, 2013.",,109400,33 of 36 people (92%) found this review helpful,True,"Otimo jogo , apesar de free muito melhor do que alguns pagos... esse jogo tem um grafico muito agradavel e bonito alem disso os mapas dele são bem divertidos... é um otimo jogo para jogar com um amigo.."
,"Posted January 29, 2014.",,440,38 of 45 people (84%) found this review helpful,True,"Muito Viciante , um jogo de FPs com uma ideia diferente e alem disso para quem gosta tem alguns mods muito bacanas fora isso sistema de trocas... Recomendo esse jogo!!"
,"Posted June 13, 2014.",,281370,3 of 4 people (75%) found this review helpful,False,a ♥♥♥♥♥ ! nem compra vei !
,"Posted November 29, 2013.",,730,1 of 2 people (50%) found this review helpful,True,"Bom , apesar de eu prefirir os tempos de cs 1.6 esse jogo da para passar um tempinho... ele tem a mesma pegada mas mudaram um pouco de algumas mecanicas que acabaram estragando um pouco , interessante é que tem novos modos , e servers BRS da valve, alem disso tem as skins de armas que não influenciam no jogo mas deixam as armas ♥♥♥♥s para quem gosta desse tipo de coisa.."
,"Posted November 29, 2013.",,48000,1 of 2 people (50%) found this review helpful,True,"Recomendo a vocês , é um jogo fantastico e não é tão caro alem disso ele mistura muito o genero de explorar o mapa com um misterio que apresenta no jogo outra coisa é que ele tem diversos puzzles não muito dificies mais que dão um acressimo de qualidade no jogo eu concerteza recomendo este jogo!"
,"Posted February 5, 2014.",,208090,1 of 4 people (25%) found this review helpful,True,♥♥♥♥ xD !
,Posted July 14.,,291550,No ratings yet,True,"Muito bom lembra os tempos de super smash , otima jogabilidade e é realmente free to play não é akele pay to win !!"
