funny,posted,last_edited,item_id,helpful,recommend,review
,"Posted June 17, 2014.",,261760,1 of 4 people (25%) found this review helpful,True,"Haven't played since release. Was a good concept then, heavy on a basic laptop, and likely better now."
,"Posted February 12, 2015.","Last edited February 12, 2015.",271290,0 of 2 people (0%) found this review helpful,False,Abandoned by the Devs: DO NOT PLAY!
3 people found this review funny,"Posted January 22, 2015.",,290340,11 of 39 people (28%) found this review helpful,True,Backed it and love it. The devs are great and have crafted a beautiful game. Sucks to be you guys who didn't get the KS swag
,Posted June 3.,,413150,No ratings yet,True,Old fashioned farming game; love it
,"Posted October 2, 2014.",,233250,No ratings yet,False,I don't know if it is my fault or what; but even with my laptop that meets the minimum requirements the game crashes when i try to enter a match. There needs to be a good amount of optimization done for the wider spectrum of hardware used
,"Posted September 29, 2014.",,293240,No ratings yet,True,Love it
,"Posted September 12, 2014.",,214190,No ratings yet,False,"It's a fun game, but still unbalanced and NOT a full release"
,"Posted May 3, 2014.",,55230,No ratings yet,True,Pretty dec game; pretty dec indeed.
