funny,posted,last_edited,item_id,helpful,recommend,review
,"Posted June 21, 2014.",,218620,1 of 1 people (100%) found this review helpful,True,"Very great game, original concept and definitely worth the money"
,Posted June 3.,,292030,2 of 3 people (67%) found this review helpful,True,"Took me 70 hours to finish the story, that says something about this game. The DLC's add a lot more gameplay, plus the free DLC. Theres somuch gameplay to it, so many challenges and sidequests. Truly a full game"
,Posted June 24.,,261640,1 of 2 people (50%) found this review helpful,True,"This game is literally BL2 in space with lasers and different action skills (With the exception of Clap-Trap), Its very good, would recommend to anyone who likes BL2"
,"Posted December 30, 2014.",,220240,1 of 2 people (50%) found this review helpful,True,"This game is amazing, the graphics, the story, the concept, the environment, it's just beautiful. I rate it 9/10"
,"Posted July 9, 2015.",,271290,1 of 3 people (33%) found this review helpful,False,"This game does't have half life 3, therefore it sucks. 0/10 would internet conspiracy again"
