funny,posted,last_edited,item_id,helpful,recommend,review
,"Posted December 6, 2014.",,8870,0 of 1 people (0%) found this review helpful,True,This game's story will blow your mind I'm not even joking + awesome gameplay
,"Posted December 6, 2014.",,11450,No ratings yet,True,So much Fun just pure Fun
,"Posted December 6, 2014.",,327410,No ratings yet,True,"Short but sweet, Great teaser for the next game in the series"
,"Posted August 25, 2014.",,206440,No ratings yet,True,"Words can't even began to describe how Beautiful this game is, Best story driven game I've ever played"
,"Posted July 26, 2014.",,252490,No ratings yet,True,"Was playing for like an hour and 1/2 logged off server for like 5 mintues to get something to eat IRL came back, a Castle had been bulit right next to me and it turned out my New neighbours were a Nudist Hatchet weilding Cult needless to say I got ♥♥♥♥ed in the ♥♥♥. 10/10 they used Lube so It was still good for me"
