funny,posted,last_edited,item_id,helpful,recommend,review
,"Posted September 4, 2015.",,730,3 of 3 people (100%) found this review helpful,False,"Yeah CS was good, But it was ruined....... By Constant Smurfs and derankers. Just played an MGE game where a Silver Elite Went 46-5. this game has turned to ♥♥♥♥"
,"Posted October 7, 2014.",,273110,2 of 2 people (100%) found this review helpful,False,"couldnt find a word for how ♥♥♥♥♥♥ it is.. only words i found were steaming, pile, goat, ♥♥♥♥ and schoolbus."
,"Posted January 2, 2014.",,247020,1 of 2 people (50%) found this review helpful,True,GAME OF THE YEAR 2013. any ♥♥♥♥♥ who dont love this game need to hvae them selfs checked.
36 people found this review funny,"Posted January 20, 2015.",,343780,18 of 37 people (49%) found this review helpful,True,Best Game 2015.'Needs Less Water'10/10 - IGN
,"Posted May 9, 2014.",,236430,No ratings yet,True,'Must Not Die.. Must Not Die.. Awww ♥♥♥♥ Im dead' - Everyone Who Has Played Darksouls!8/10 only dissapontment was the large need for a controler!
