funny,posted,last_edited,item_id,helpful,recommend,review
,"Posted September 29, 2015.","Last edited October 8, 2015.",391460,No ratings yet,False,no au servers also the dev needs to add content like server hosting the ♥♥♥♥ is a lying ♥♥♥♥♥♥♥ with fetures want refund for free game
,"Posted September 24, 2015.",,239140,No ratings yet,True,its ok
,"Posted December 25, 2014.","Last edited September 27, 2015.",218230,No ratings yet,True,10gb steam download 30gb in game download 1110 would download again
,"Posted November 16, 2014.",,33930,No ratings yet,True,Unlike most people these days i did not buy the game for dayz  but for all the content I have played more vanila and other mods (like island life and single player mods)then i have for dayz so if you don't like dayz style games you should still this ♥♥♥♥ because there more mods and ♥♥♥♥ then there are people like seriously there is (maybe over doing it there a bit)but ♥♥♥♥ing hell buy this game man/woman69/10 would play again(I do play dayz and infact host a server now so I do like the dayz mod but this review is more focused on all round ♥♥♥♥)
,"Posted June 14, 2014.",,440,No ratings yet,True,got in orage box retail worth it! best fps ever
,"Posted January 25, 2014.",Last edited April 25.,221100,No ratings yet,False,Got BE Banned for lagging  GG
,"Posted March 14, 2013.","Last edited May 25, 2014.",224540,No ratings yet,False,game was great then update came out game was horrible
