funny,posted,last_edited,item_id,helpful,recommend,review
,"Posted December 6, 2014.","Last edited December 6, 2014.",270150,1 of 1 people (100%) found this review helpful,True,"I have no words for this game. The controls are perfect and intuitive; you know that any mistakes you make are your own and believe me, you will make mistakes.8.8/10"
,"Posted May 14, 2014.",,48700,2 of 3 people (67%) found this review helpful,True,"A masterpiece of modern gaming, 9/10"
,"Posted November 10, 2014.",,317360,1 of 2 people (50%) found this review helpful,True,Diving Off a platform onto the floor metres below while shooting a guy in the face with an smg while in slo mo.Priceless
,"Posted May 9, 2014.",,238890,2 of 5 people (40%) found this review helpful,True,"Not a bad game, just not an awfully good one."
,"Posted December 10, 2013.",,31740,2 of 10 people (20%) found this review helpful,True,"This game is great, I love it."
,"Posted January 4, 2014.",,36620,No ratings yet,True,A fun game with good movement but I wish the combat was fluid instead of button pressing.
