funny,posted,last_edited,item_id,helpful,recommend,review
2 people found this review funny,Posted February 6.,Last edited February 6.,252950,2 of 2 people (100%) found this review helpful,True,"I bang into my teammate, he fly.I own goal, my teammate says 'YOUUUUUUUU'.I center the ball for the enemy, my teammate be like 'WHYYYYY'.I ks the ball from my teammate, he be panting 'angrily'.10/10 would ks the ball again.P.S.: referring to a weird ducky"
,Posted April 23.,,730,1 of 1 people (100%) found this review helpful,True,mg 1 noob kid needs knife pls.
1 person found this review funny,"Posted April 26, 2015.","Last edited April 30, 2015.",271590,1 of 1 people (100%) found this review helpful,True,"Killing is fun, Heists is fun, Earning money is fun, Driving is fun, Flying is fun, Game is fun... EVERYTHING ABOUT THE GAME IS FUN... except me dying :C. buy it. worth it. u wont waste ur money.Thanks GodofNothing for buying it for me =DD"
,"Posted November 9, 2013.",,105600,1 of 1 people (100%) found this review helpful,True,"Minecraft is better though , but its easier to kill monsters. Unlike minecraft , theres a team icon there. (im not sure if minecraft have that too :/)"
1 person found this review funny,"Posted October 18, 2015.",,440,2 of 3 people (67%) found this review helpful,True,i r8 8/8. longest game i played in my life.
1 person found this review funny,"Posted December 3, 2013.",,4000,2 of 3 people (67%) found this review helpful,True,Its a nice game and i managed to build a car from a help from someone the day i started it.... and it goes out of control sometimes and i go giddy. but still..... BUY IT!
2 people found this review funny,"Posted April 26, 2015.","Last edited April 26, 2015.",232090,1 of 2 people (50%) found this review helpful,True,I was scared at first but..... I TRIED IT AND ITS AWESOME. thank kimi for that ( ͡° ͜ʖ ͡°). im still a kid so im scared :CCCandd...... THANK YOU GODOFNOTHING FOR GIVING A POOR CHEETAH KILLING FLOOR 2 ( ͡° ͜ʖ ͡°)
,"Posted February 15, 2015.",,104900,No ratings yet,True,just buy it. its worth it. just a few dollars for many hours.
