funny,posted,last_edited,item_id,helpful,recommend,review
,"Posted May 13, 2013.",,4000,3 of 4 people (75%) found this review helpful,True,aprovado :)
,Posted January 9.,,389570,1 of 1 people (100%) found this review helpful,True,jogo bem gostoso de comer os outros
,"Posted June 4, 2015.",,105600,1 of 2 people (50%) found this review helpful,True,simplesmente um dos melhores jogos q eu já joguei
,"Posted January 3, 2014.",,204340,1 of 3 people (33%) found this review helpful,True,"recomendo pq o jogo é uma prova q n precisa de ter gráficos bons pra ser legal ,um jogo frenético com muita emoção recomendo"
2 people found this review funny,"Posted June 16, 2015.",,252490,0 of 1 people (0%) found this review helpful,True,Um jogo bem loco q da vontade de virar terrorista e mata td mundo dai pegar a arma mais forte do jogo e matar lobo e galinha inofensiva
,"Posted October 14, 2014.",,319510,4 of 12 people (33%) found this review helpful,True,eu n consegui jogar ainda pq to com medo mas qnd puder eu jogo
,"Posted October 21, 2015.",,218620,No ratings yet,True,"realmente achei muito bom, se vc jogar tomando suco de laranja fica ainda mais relaxante"
,"Posted July 16, 2015.",,226700,No ratings yet,True,"um dos melhores jogos de sobrevivência, infelizmente tem muitos hacks mas o jogo é muito bom, váaaarias armas e na minha opnião 10000 vezes melhor q dayz"
,"Posted June 16, 2015.",,238280,No ratings yet,True,é bom de jogar com os amigo principalmente usando controle pq daí fica bem massa e loko
