funny,posted,last_edited,item_id,helpful,recommend,review
,"Posted July 29, 2015.",,221100,4 of 4 people (100%) found this review helpful,False,"If you want to waste your money on a doomed game that will never be complete, go ahead."
1 person found this review funny,Posted August 21.,,275850,5 of 7 people (71%) found this review helpful,False,Do not buy. Wait for Dual universe or Star citizen.
,"Posted August 1, 2014.",,242760,1 of 1 people (100%) found this review helpful,True,Lots of great ideas and are implemented very well!
,"Posted April 19, 2014.",,261030,1 of 1 people (100%) found this review helpful,True,"Buy it, it's a good game."
,"Posted April 2, 2014.",,220200,1 of 1 people (100%) found this review helpful,True,Aweome fun game if you're into building space craft!
1 person found this review funny,Posted January 12.,,319630,0 of 2 people (0%) found this review helpful,True,Rich story that's full of twists and a great soundtrack that really takes you into the game. Must buy!
