funny,posted,last_edited,item_id,helpful,recommend,review
7 people found this review funny,"Posted July 2, 2015.",Last edited February 18.,12120,29 of 31 people (94%) found this review helpful,True,几乎电台的每一首歌都能跟着哼哼出来……可惜最后版权有点问题……相比之下对GTA5电台没什么印象满脑子都是一些南方洗脑歌，反而蛮喜欢GTA5的游戏背景音乐还是更喜欢90年代的西海岸圣安地列斯—永远的经典
,"Posted June 22, 2015.",,261570,1 of 1 people (100%) found this review helpful,True,通关之后整个世界都美好了 ！！！上一个让我有这种感觉的可能是传送门2但是！！！地圖有一块没探索完！！！东西差一个收集齐！！！通关后存档就打不开了……这下全世界都'没好'了……感觉没有周目二的勇气……等表弟小学毕业给他玩吧……
1 person found this review funny,Posted January 20.,,378660,1 of 3 people (33%) found this review helpful,True,一定要买原声https://youtu.be/pSN6_OGdIpA
,Posted March 3.,,417860,No ratings yet,True,入戏太深……
,"Posted July 4, 2015.",,369580,No ratings yet,True,多么一个厚颜无耻的游戏……
