funny,posted,last_edited,item_id,helpful,recommend,review
,"Posted August 11, 2014.",,730,1 of 1 people (100%) found this review helpful,True,One of the great tactic shooters out there!To have more fun make sure you have a group of 5 friends :P 910
,"Posted July 8, 2014.",,304930,1 of 1 people (100%) found this review helpful,True,BEST GAME EVER TO EXIST!!!1010
,"Posted July 3, 2014.",,291480,1 of 2 people (50%) found this review helpful,False,The gameplay itself is really fun but the fact that you have to pay for weapons that last only for a couple of days really makes the game bad...
,"Posted August 11, 2014.",,240,4 of 13 people (31%) found this review helpful,False,this game sucks
,"Posted October 11, 2014.",,244850,No ratings yet,True,Funny game to play with friends although the make it a bit of hard to get items. 810
