funny,posted,last_edited,item_id,helpful,recommend,review
,Posted February 27.,,349700,3 of 6 people (50%) found this review helpful,False,Just no.Trust me dis game sucks!
1 person found this review funny,Posted May 11.,,8930,0 of 2 people (0%) found this review helpful,True,I REALLY LOVE THIS GAME WHAT THE HELL ARE YOU DOING GET THE DAM GAME NOW!!!
,"Posted May 30, 2015.",,304930,0 of 2 people (0%) found this review helpful,True,This game is very good by very good i mean hella good by! XD
,"Posted June 3, 2015.",,374570,No ratings yet,True,I don't know what the hell I watched
,"Posted April 9, 2015.",,264730,No ratings yet,True,"It is a great game, where you have to survive for a month. There aren't a big amout of weapons, but like I said it is a great game also it would be even better with more maps.4.5/5"
,"Posted November 13, 2014.",,241930,No ratings yet,True,The best f***ing game ever!
,"Posted July 13, 2014.",,227940,No ratings yet,True,Best free game out there!!!!
,"Posted July 2, 2014.",,265930,No ratings yet,True,one of the best games on steam i recomond it for everyone.
,"Posted June 27, 2014.",,238460,No ratings yet,True,Its a great game if your up for a challenge or just want to play a great game
