funny,posted,last_edited,item_id,helpful,recommend,review
1 person found this review funny,"Posted October 14, 2015.",,346110,No ratings yet,True,"Day 1: Built wood house, Got raided.Lesson 1: Build stone houses.Day 2: Built stone houses and forges. Got raided.Lesson 2: Build metal houses fast.Day 3: Built metal house. Got raided.Lesson 3: Increase defenses.Day 4: Built smaller metal house. double the doors. Got raided.Lesson 4: Theres always someone with a ton of c4 out there.Day 5: Built a small metal house. Built a double layer wall stone house on the beach with a vault + 15000 Thatch inside and a sign saying 'C4 Storage'. Vault still stands, almost all stone walls blown to bits. Metal house survives.Lesson 5: Waste enemy C4 with a dummy house.Skills gained: Can build a metal house in godly speed"
,"Posted December 30, 2014.",,70400,No ratings yet,True,"If you enjoyed that part in Digimon World on PS1 where you had to sell items to customers to reach a quota and continue the storyline, you will enjoy this game immensely."
,"Posted June 22, 2014.",,237890,No ratings yet,False,"Installed the 5gb, played a few minutes, half hour. Conclusion : I'd rather play other JRPG games, god this was so boring, dialogue is so cheesy, music doesn't really match and gameplay is clunky. Animations also are clunky. Pros? Can get cards for getting those anime similar backgrounds after crafting badge"
,"Posted December 2, 2013.",,570,No ratings yet,True,"Fun game, team can be ♥♥♥♥ at time, play with friends for best experience"
,"Posted May 14, 2013.",,1250,No ratings yet,True,"Mindless killing, L4D + COD-zombies"
