funny,posted,last_edited,item_id,helpful,recommend,review
,"Posted December 31, 2014.",,730,1 of 1 people (100%) found this review helpful,True,10/10 would play with drunks on New Years Eve again
1 person found this review funny,"Posted October 10, 2015.",,330830,1 of 3 people (33%) found this review helpful,True,HO. LY. CRAP! I will never hurt a loader bot in my life ever again. I repent of all previous times that i have done so and wish to start a life anew where I am a friend to the Loader Bots. Damn best story i've heard in a long time.
,Posted June 24.,,396260,No ratings yet,True,Probably the most accurate portrayal of Australia I have ever witnessed
,"Posted September 10, 2014.",,214510,No ratings yet,True,This game sent me on a feels trip :') LOTR + A more serious LEGO + Voices straight out of the movie = An incredible game. However $50 does seem like a lot for a lego game so wait until its cheeper (I got it for $5)
,"Posted June 28, 2014.",,234490,No ratings yet,False,I would be more likely to grate my head against a grater and eat the pieces then play this again. Controls just aren't responsive enough
