funny,posted,last_edited,item_id,helpful,recommend,review
3 people found this review funny,"Posted March 19, 2015.",,223470,4 of 5 people (80%) found this review helpful,True,Dear Diary Today i ♥♥♥♥♥♥ on a cop♥♥♥♥♥♥ on a dog♥♥♥♥♥♥ on a protester♥♥♥♥♥♥ on a cat♥♥♥♥♥♥ on Gary Coleman♥♥♥♥♥♥ on The Taliban♥♥♥♥♥♥ on a priest♥♥♥♥♥♥ on my father's graveand ♥♥♥♥♥♥ on a guy taking a ♥♥♥♥10/10 would ♥♥♥♥ on things again
2 people found this review funny,"Posted October 15, 2015.","Last edited December 13, 2015.",550,1 of 1 people (100%) found this review helpful,True,Thanks to mods this game seems like a hilariously bad fan-fiction
,Posted April 20.,,212680,No ratings yet,True,I hate this game. And it hates me backSo i guess thats fair.
2 people found this review funny,"Posted October 15, 2015.",,233450,No ratings yet,True,Its all fun and games until a legandary prisoner with an 800 year sentence and over 20 convictions of murder arrives and kills everybody.
2 people found this review funny,"Posted January 29, 2015.",Last edited September 9.,570,No ratings yet,True,This game taught me how swear in 17 different languages 10/10
1 person found this review funny,"Posted December 12, 2014.","Last edited December 12, 2014.",440,No ratings yet,True,Nearly spent 2000 hours in this gameevery second is worth it
