funny,posted,last_edited,item_id,helpful,recommend,review
518 people found this review funny,"Posted April 18, 2015.",,105600,372 of 440 people (85%) found this review helpful,True,-I caught a bunny in a bug catcher-Material???-Guide Help Me-Terrainium + Bunny = Bunny in a cage... K-Dynamite + Bunny = Explosive bunny.!!! who would do such a thing!-Use for bunny cannon. AHHH! WHY!-Puts Dynamite on bunny... -Yell Allah Akbar and Dies with bunny10/10 would Terrorise again
,"Posted December 30, 2015.",,351990,1 of 1 people (100%) found this review helpful,True,"Quite the fun rhythm game, and suprisingly goes with the songs well.And its very optimised, I'm running this on just an i3 and on 1360x768 and I still get 60fps.Also does anyone else see the logo as 'DAY' instead of 'DAT'??"
,"Posted July 2, 2015.",,4000,1 of 1 people (100%) found this review helpful,True,"Okay Okay, Let me get my story straight, I joined a TTT server at around 10Stayed on until around 1 am. NOWEverything was normal until 12am, All I'm gonna say isOne thing thing lead to another and we made 3 pornos.10/10 would make Horse and ♥♥♥♥♥ Porno again. (link soon)"
1 person found this review funny,"Posted April 26, 2015.",,730,1 of 1 people (100%) found this review helpful,True,Play CS:GO and you'll become MLG at COD.
,"Posted February 16, 2015.",,270450,No ratings yet,True,More australians need to play multiplayer because this is an awesome game for having a muck around in. Even playing againts the bots is quite a difficult task but they play more naturally and doesn't seem like they are realy bots. If that makes sense :)
