funny,posted,last_edited,item_id,helpful,recommend,review
,"Posted December 28, 2014.",,286500,3 of 4 people (75%) found this review helpful,True,cool game and cool story
,"Posted February 28, 2015.",,247000,1 of 2 people (50%) found this review helpful,True, i like this game but idont have a friend to play with because they dont have it**feeling lonely* * :((
,"Posted December 19, 2014.",,265330,0 of 1 people (0%) found this review helpful,True,cool ^ ^ game
,"Posted February 2, 2015.",,227220,1 of 4 people (25%) found this review helpful,False,idont know but its white screen on my laptop so sad :((
,"Posted January 7, 2015.",,334930,0 of 4 people (0%) found this review helpful,True,fun game cool puzzle buy this guyz - make a machine-create and combinei give this 7/10
,"Posted December 20, 2014.",,280930,0 of 5 people (0%) found this review helpful,False,fake game i buy it and start it already game crash report lose money damn not good game
,"Posted January 15, 2015.",,256410,No ratings yet,True,awesome gamebut idont know how to use the tournament ticketplease tell me how to use or there is lvl that can be on tournament
,"Posted January 5, 2015.",,38600,No ratings yet,True,good game
,"Posted December 20, 2014.","Last edited January 4, 2015.",259550,No ratings yet,True,i give this a 10/10good game clicking . .finding mushroomz and other stuff little hard because mushrooms so little but i complete the achievements of ittry this its nice game
