funny,posted,last_edited,item_id,helpful,recommend,review
,"Posted April 14, 2014.",,570,2 of 3 people (67%) found this review helpful,True,This game is just so addicting .... but its great!
1 person found this review funny,"Posted December 4, 2014.",,293560,1 of 4 people (25%) found this review helpful,False,"This game is horrible. Everything is bad about it, the controls, the fighting and the screen movement ITS ♥♥♥♥ I TELL YA"
1 person found this review funny,"Posted August 19, 2015.",,233250,0 of 4 people (0%) found this review helpful,True,Great game to play just needs more updates and units
1 person found this review funny,"Posted August 20, 2015.",,386070,26 of 66 people (39%) found this review helpful,True,I take back ALL comments I said about this should be free! Its well worth the money and its soooo much more fun now with all the new units and what not!
,Posted April 5.,,427270,No ratings yet,True,Its alright but it could be better. Its still no where near as good as OMD 1 & 2
,"Posted July 13, 2014.",,248570,No ratings yet,True,10/10 would bang multiple times
