funny,posted,last_edited,item_id,helpful,recommend,review
,"Posted July 6, 2015.",,240,1 of 1 people (100%) found this review helpful,True,"Oh, where do I start with this game. If I could say one word for this game it would probably be.... Amazeballs! The way you feel while playing this FPS teambased game is so different from any other. This game was one of my first paid games and I will never regret it, it has made me grow in my FPS gaming skills.Score: 10/10-MC Digby The 1337th"
,"Posted December 31, 2013.",,730,1 of 1 people (100%) found this review helpful,True,Best game to play competitive and amazing for people who want to grow there skills with FPS games10/10
,Posted January 5.,,570,No ratings yet,True,ehh
,"Posted October 20, 2012.",,209870,No ratings yet,True,LOVE IT YOU BETTER TOO
,"Posted July 15, 2012.",,440,No ratings yet,True,This game is my favourite shooter on the PC I give it 10/10 Get it :D
