funny,posted,last_edited,item_id,helpful,recommend,review
4 people found this review funny,"Posted December 23, 2015.",,405170,16 of 28 people (57%) found this review helpful,False,"Eh. The car can't be customised and the parts are exclusive to the car.If you like BTTF, then by all means buy this.I just bought it so I have everything."
,"Posted October 30, 2015.",,413850,2 of 2 people (100%) found this review helpful,True,O-Scopes
1 person found this review funny,Posted January 30.,,208090,3 of 4 people (75%) found this review helpful,False,"I loved you like a son.Why did you forsake me, Loadout?I paid $20 bucks for the launch pack."
,"Posted June 25, 2015.",,730,No ratings yet,True,Matchmaking simulator 2015aka Operation Bloodhound.Worth the wait.
,"Posted December 22, 2014.",,620,No ratings yet,True,May or may not contain cake.10/10 best cake simulator there is.
,"Posted January 12, 2014.",,211820,No ratings yet,True,"This game may be in early beta, but it is still awesome to play, glitches and all"
