funny,posted,last_edited,item_id,helpful,recommend,review
,"Posted June 19, 2014.",,2400,1 of 1 people (100%) found this review helpful,True,Kill Bush with a purse bomb.
,"Posted June 19, 2014.",,219150,1 of 1 people (100%) found this review helpful,True,Can wear a ♥♥♥♥ mask. 11/10
,"Posted February 21, 2014.",,208090,1 of 1 people (100%) found this review helpful,True,Dont have to wear pants. 10/10-Shane Gornik
,"Posted February 21, 2014.",,201790,1 of 1 people (100%) found this review helpful,True,Orcs and ♥♥♥♥.-Shane Gornik
,"Posted December 15, 2013.",,220240,1 of 1 people (100%) found this review helpful,True,This game is great.-Shane Gornik
,"Posted November 27, 2013.",,440,1 of 1 people (100%) found this review helpful,True,TF2 is Good if your sweg.-Shane Gornik
