funny,posted,last_edited,item_id,helpful,recommend,review
,"Posted July 12, 2015.",,252490,4 of 4 people (100%) found this review helpful,True,"업데이트 된뒤로 상당이 좋아진듯 하다 문제는 너무 좋아져서 렉걸려서 못한다.,"
1 person found this review funny,Posted January 17.,,391540,1 of 2 people (50%) found this review helpful,True,한줄평스토리에 취하고 bgm에 취한다.
,Posted March 20.,Last edited March 20.,440,No ratings yet,True,우리팀 메딕은 왜 힐안함?미안. 힐 안해줘서
,"Posted January 23, 2015.",,250180,No ratings yet,True,업데이트 뒤에 장점보다 단점이 더 많이 생긴듯 하다마메보다 못하는거 같아서 아쉽다
,"Posted August 27, 2014.",,217140,No ratings yet,True,이게임은 정말 엄청나다 점프를 하면 매우찰진 흑형의 사운드를 들을수있다.만약 이게임을 구매 하였다면 흑형의 찰진 사운드를 감상해보자
