funny,posted,last_edited,item_id,helpful,recommend,review
,"Posted March 20, 2014.",,620,1 of 1 people (100%) found this review helpful,True,One of the best games ever!
,"Posted July 2, 2014.",,440,1 of 2 people (50%) found this review helpful,True,Awesome!
1 person found this review funny,"Posted January 9, 2015.",,295270,0 of 3 people (0%) found this review helpful,True,It's one of the best football games hands down
,"Posted November 8, 2014.",,312990,No ratings yet,True,This is the greatest game ever and it's also free!!!!!!!!!!!!!!!!!!!!!!!!!!!!!
,"Posted July 2, 2014.",,249870,No ratings yet,True,Can't stop playing!
,"Posted April 17, 2014.",,213330,No ratings yet,True,A must have for lego fans!
