funny,posted,last_edited,item_id,helpful,recommend,review
,"Posted December 26, 2015.",,264200,No ratings yet,True,Ever wanted to look like Jet lee and Jackie Chan without all the hard work and instead only using two buttons?then get this game10/10
,"Posted December 24, 2015.",,4000,No ratings yet,True,"you can play other games in this gameno im not kiddingjust check my hours into this game as well as my screenshotsthe reason why i have over 1000 hours is because this game keeps evolvingwith new mods and maps and moreif you just want to play with your friends (which is what i do the most) just get a VPN program like Evovle and host a lan server.so overallthis game is basicly every. game. ever. put into one game, thats only 4gbbest game on steam 1000/1000also my addon list is now 29gb lol"
,"Posted December 23, 2015.",,248570,No ratings yet,True,1v1 random guyhe grabs mei spam everything on my left legsomehow do a kick to his facewin game10/10 would kick again
,"Posted December 23, 2015.",,416690,No ratings yet,True,Your Mother still uses Windows Vista and worked with the Nazis! Sir!10/10 best insult generator ever
,"Posted December 11, 2015.",,630,No ratings yet,True,Free Co Op Game!
,"Posted November 8, 2014.",,322070,No ratings yet,True,yay gore
,"Posted September 28, 2014.","Last edited December 8, 2015.",730,No ratings yet,False,Better off getting Rainbow Six: Siege instead of this game due to the community.like srsly i killed 2 people on the enemy team then all of a sudden they vote kick me.0/10
,"Posted September 25, 2014.","Last edited May 15, 2015.",440,No ratings yet,True,HATSSSSSSS
,"Posted September 18, 2014.","Last edited December 20, 2015.",304930,No ratings yet,False,"skins, cause why not?its an ok game, it just gets boring after a while"
