funny,posted,last_edited,item_id,helpful,recommend,review
1 person found this review funny,Posted February 17.,,304930,2 of 3 people (67%) found this review helpful,True,mto loko tenho gold e recomendo pra todomundo :^))
,"Posted April 4, 2015.",,222880,0 of 1 people (0%) found this review helpful,True,good game to ALLAHU AKBAAR :Dtalking serious this is a good game to play because it looks like tf2you have an class that use an gun like the bomber uses bombs(obvious) recon uses rilfes and etc..420/10 2 fast 4 me :D
,"Posted April 4, 2015.",,212800,No ratings yet,True,cool game and awesome soundtracki recommend 8/10
1 person found this review funny,"Posted March 15, 2015.",,248570,No ratings yet,True,very interesting physics and good customizing option very good game i reccomend :D
,"Posted December 22, 2013.",,4000,No ratings yet,True,best game i ever played!!
