funny,posted,last_edited,item_id,helpful,recommend,review
,"Posted August 13, 2014.","Last edited October 18, 2015.",218620,No ratings yet,False,As ive said in my Teamfortress 2 review this game went from amazing banking game to a ♥♥♥♥♥♥ wreck. The game was amazing but now DLC and micro transaction rule. I was fine with the addition of skins but giving them stats cmon Almir you said it was free you d*ckwad and you said payday 2 would never have micro transactions. We are disapointed OVERKILL. Just remove the crates or atleast the additional stats :(
,"Posted March 1, 2014.",,24240,No ratings yet,True,Really fun and a good co-op game
,"Posted February 26, 2014.","Last edited October 30, 2014.",113400,No ratings yet,False,Terrible thats it just ♥♥♥♥♥♥. ♥♥♥♥♥♥♥t mother♥♥♥♥ing ♥♥♥♥♥♥♥t
,"Posted January 19, 2014.","Last edited April 11, 2015.",206420,No ratings yet,False,Piece of rotting ♥♥♥♥ is all this game is
,"Posted October 14, 2013.","Last edited June 11, 2015.",220,No ratings yet,True,Half-Life 2 is a bit old but is a very good gameIn fact the best ♥♥♥♥ing game ever
,"Posted February 8, 2013.",,17500,No ratings yet,True,Realy good mod dont join fancy servers first time playing YOU WILL BE KICKED
,"Posted December 15, 2012.","Last edited July 3, 2015.",218230,No ratings yet,True,Very Fun not as fun as it used to be as all f2p games become
,"Posted December 15, 2012.","Last edited July 3, 2015.",620,No ratings yet,True,Get it just get it 10/10 would eat cake again
,"Posted November 24, 2012.","Last edited July 3, 2015.",4000,No ratings yet,True,Farted on a guys head. He died 10/10 would ♥♥♥♥ again
