funny,posted,last_edited,item_id,helpful,recommend,review
,Posted June 30.,,427520,No ratings yet,True,"This game is extremely addicting to play by yourself and with friends, so many hours to create a perfect factory"
,"Posted September 20, 2015.",,322330,No ratings yet,True,This game is great I've played 6 hours straight with one of my friends this is great
,"Posted August 31, 2014.",,64000,No ratings yet,True,muitplayer shut down
,"Posted June 26, 2014.",,233450,No ratings yet,True,Damn good game still in aphla thougth but I have with it since aphla 7
,"Posted August 23, 2013.",,3720,No ratings yet,True,Really good game but it is from 2004 and it is fun to play.
