funny,posted,last_edited,item_id,helpful,recommend,review
5 people found this review funny,"Posted December 13, 2014.","Last edited August 25, 2015.",6060,15 of 15 people (100%) found this review helpful,True,"every so often a game comes along, a game unlike any other,a game that can make you so happy that your eye balls explode from your head,Star Wars BattleFront II is this exact game.as a first look of the game on steam, i thought it looked pretty dull, and being the star wars fan i was, i didnt want to waste my money on a star wars game that would ruin things for the franchise. however being an expert yoloist i decided that you  have got to take some risks, and so i bought it.THIS GAME IS AWESOME!!! play as a clone and KICK THE S*IT out of droids, play as a jedi and 1 hit kill EVERYTHING, THE POSSIBILITIES!!! this game for me was based on the graphics and the gameplay, the graphics well, being made 10 years ago, are pretty good. and the gameplay is just so amazing i found myself in tons of positions where my heart is pounding out of its chest because i wanted to win so badly.all in all this game really won me over, and i mean this game is even a bargain at $10, if you are a star wars fan, GET THIS GAME! you will love it 9.5/10 BRING BACK THE MULTIPLAYERS!!!"
,"Posted November 28, 2013.","Last edited January 17, 2015.",32440,9 of 9 people (100%) found this review helpful,True,"First off let me tell you that this is one of the best games i have ever played,it is brilliant, fantastic, awesome and just wonderful.i love this game so much that i have it on three consoles :Dif you ever have a chance to buy this please do its amazinghow many of you have ever wanted to have a lightsaber in your hand, ever wanted to use the force, or even blast the crap out of some droids or stormtroopers... well this game is the closest your ever gonna get. some challenging puzzles, build awesome stuff and even create your own JEDI :D"
,"Posted August 19, 2014.","Last edited January 17, 2015.",400,1 of 1 people (100%) found this review helpful,True,"PORTAL,portal is a physics based puzzle game, that turns games that you would think to be boring (in a category so) and makes them fun. there are 19 levels in portal each with its own fun and excitement.i think this is a great little story game and is deffinetly recommended 9/10"
,"Posted May 23, 2014.",,47870,1 of 4 people (25%) found this review helpful,False,WORST GAME I HAVE EVER PLAYEDABSOLUTE S*IT EA YOU ARE A CRAP COMPANY WHO MAKE S*IT GAMES SCREW YOU!!!
,"Posted January 31, 2015.",,94400,No ratings yet,True,stabbed my friend in the chest witha sword... 10/10
,"Posted January 31, 2015.",,204360,No ratings yet,True,killed something 10/10
,"Posted February 16, 2014.","Last edited January 17, 2015.",223670,No ratings yet,True,"F1 2013this game is for the Real Simulators, a racing game unlike any other,a game so amazing, that it has to be one of the best simulation racing games everAwesome fun Racingup to 3 G-Forces of forceWild Fast deep cornersAwesome online, split screen or LAN multiplayerPlay as your favourite driver or team... F1-2013"
,"Posted November 14, 2013.",,232910,No ratings yet,True,"trackmania is a fantastic game,build race tracks play single player or vs the world. if you like racing you will love this game its so much fun."
