funny,posted,last_edited,item_id,helpful,recommend,review
1 person found this review funny,"Posted November 21, 2015.",Last edited March 12.,417860,4 of 4 people (100%) found this review helpful,True,bloop
,"Posted January 1, 2014.","Last edited December 9, 2015.",550,2 of 2 people (100%) found this review helpful,True,Fun game for people that do not like violance and like walking around and adventuring and planting trees.2015 - 10/10 game for killing hoes
,"Posted March 12, 2014.",,91600,1 of 1 people (100%) found this review helpful,True,"As of posting this, it's three dollars for a four pack.10/10"
,"Posted December 27, 2013.",,620,1 of 1 people (100%) found this review helpful,True,"Great game, especially for coop :D"
2 people found this review funny,"Posted July 22, 2015.",,208650,1 of 3 people (33%) found this review helpful,False,this port is just painful crashes
,Posted January 21.,,95400,No ratings yet,True,"I too, enjoy drawing pink male reproductive organs."
