funny,posted,last_edited,item_id,helpful,recommend,review
,"Posted December 6, 2014.",,224540,3 of 6 people (50%) found this review helpful,True,it is a good game for pvp sandbox and zombies so yeah i liked it
,"Posted January 14, 2014.",,224580,0 of 1 people (0%) found this review helpful,True,it is so good 9/10 it is a mod but is still greate
,"Posted June 13, 2015.",,17300,No ratings yet,True,"Love it to death. this was my frist computer game ever back in 2008, and is still todate a great game."
,"Posted February 8, 2015.",,107900,No ratings yet,False,if anyone downloads it now or get warz/ISS i will hunt you down
,"Posted December 31, 2014.",,236390,No ratings yet,True,great game played it with my brother its great
,"Posted June 24, 2014.",Last edited April 30.,226700,No ratings yet,False,The dev's of the game are so lazy that they let hackers into the game from time to time just for the fun of it.
