funny,posted,last_edited,item_id,helpful,recommend,review
2 people found this review funny,Posted January 10.,,206190,3 of 3 people (100%) found this review helpful,True,"Really good game has comedy, stealth, killin ♥♥♥♥ and the best feature... KICKING MOTHER♥♥♥♥ING DOORS DOWN!"
,"Posted March 18, 2014.",,271290,1 of 3 people (33%) found this review helpful,True,Really Fun Better Than TitanFall In My Opinion
1 person found this review funny,"Posted April 14, 2014.",,252490,0 of 1 people (0%) found this review helpful,True,This is a really good game and in my opinion better than DayZ
1 person found this review funny,"Posted January 26, 2015.",,247730,2 of 7 people (29%) found this review helpful,True,Tis a good game...nuff said
,Posted August 26.,,381210,No ratings yet,True,Gud Gaem
,"Posted December 23, 2013.",,730,No ratings yet,True,Its a good game its like TF2 but counterstrike and its like counterstrike source but with a fresh coat of paint
