funny,posted,last_edited,item_id,helpful,recommend,review
,"Posted May 26, 2015.",,730,1 of 1 people (100%) found this review helpful,True,awesome game love it
,"Posted July 20, 2015.",,323370,No ratings yet,True,wonderful rpg game
,"Posted July 20, 2015.",,242700,No ratings yet,True,the graphics of this game is beautiful
,"Posted July 20, 2015.",,363970,No ratings yet,True,"Nice easy going game, gets intense"
,"Posted July 20, 2015.",,40800,No ratings yet,True,"Something so simple but yet so good, recommended."
