funny,posted,last_edited,item_id,helpful,recommend,review
1 person found this review funny,"Posted October 27, 2015.","Last edited October 28, 2015.",403190,9 of 13 people (69%) found this review helpful,False,"This game gives user an achievement when they enter the game menu, which means buy this game is some sort of achieving? Also, people in game never took a dump, while I'm feeling a little bit constipation for a while, ♥♥♥♥♥♥ me off.I've done another run, everyone is starving to death while at the same time I have 100+ vegi and 80+ meat in stock, FYI there are 3 canteens for around 80 survivors, I think those resource is quite enough to use for a long while if AI is not at dumb as this."
3 people found this review funny,"Posted August 25, 2015.",,236850,3 of 5 people (60%) found this review helpful,True,Not a bad game.
,"Posted December 31, 2013.",,8930,No ratings yet,True,Go playing this game if you don't know how to waste your time. PS If you love STR games.
,"Posted June 27, 2013.",,213850,No ratings yet,True,1024
,"Posted January 20, 2013.",,97330,No ratings yet,True,MTGGGGGG
